21519115,5,2.37,6.38,8.39,0.37,19.7,2012,Drosophila gene expression pattern annotation through multi-instance multi-label learning.,"Li, Ying-Xin; Ji, Shuiwang; Kumar, Sudhir; Ye, Jieping; Zhou, Zhi-Hua",IEEE/ACM Trans Comput Biol Bioinform,TRUE
21530737,93,29.91,4.59,5.96,6.52,96,2011,Development of the human gastrointestinal microbiota and insights from high-throughput sequencing.,"Dominguez-Bello, Maria Gloria; Blaser, Martin J; Ley, Ruth E; Knight, Rob",Gastroenterology,FALSE
21552263,256,82.34,5.86,8.29,14.06,99.1,2011,Genome partitioning of genetic variation for complex traits using common SNPs.,"Yang, Jian; Manolio, Teri A; Pasquale, Louis R; Boerwinkle, Eric; Caporaso, Neil; Cunningham, Julie M; de Andrade, Mariza; Feenstra, Bjarke; Feingold, Eleanor; Hayes, M Geoffrey; Hill, William G; Landi, Maria Teresa; Alonso, Alvaro; Lettre, Guillaume; Lin, Peng; Ling, Hua; Lowe, William; Mathias, Rasika A; Melbye, Mads; Pugh, Elizabeth; Cornelis, Marilyn C; Weir, Bruce S; Goddard, Michael E; Visscher, Peter M",Nat. Genet.,TRUE
21552286,544,174.98,4.90,6.53,35.71,99.8,2011,Evolution and classification of the CRISPR-Cas systems.,"Makarova, Kira S; Haft, Daniel H; Barrangou, Rodolphe; Brouns, Stan J J; Charpentier, Emmanuelle; Horvath, Philippe; Moineau, Sylvain; Mojica, Francisco J M; Wolf, Yuri I; Yakunin, Alexander F; van der Oost, John; Koonin, Eugene V",Nat. Rev. Microbiol.,TRUE
21558194,7,1.70,5.17,7.61,0.33,17.2,2010,Genome biology of the cyclostomes and insights into the evolutionary biology of vertebrate genomes.,"Smith, J J; Saha, N R; Amemiya, C T",Integr. Comp. Biol.,TRUE
21563978,7,2.25,6.27,9.04,0.36,19,2011,ComB: SNP calling and mapping analysis for color and nucleotide space platforms.,"Souaiaia, Tade; Frazier, Zach; Chen, Ting",J. Comput. Biol.,TRUE
21445444,6,1.93,4.12,5.09,0.47,25.2,2011,Optical tweezers directed one-bead one-sequence synthesis of oligonucleotides.,"Wang, Tao; Oehrlein, Stefan; Somoza, Mark M; Perez, Jose R Sanchez; Kershner, Ryan; Cerrina, Franco",Lab Chip,TRUE
21587300,306,98.42,5.67,7.93,17.37,99.4,2011,Genotype and SNP calling from next-generation sequencing data.,"Nielsen, Rasmus; Paul, Joshua S; Albrechtsen, Anders; Song, Yun S",Nat. Rev. Genet.,FALSE
21596952,174,55.97,6.41,9.30,8.73,97.7,2011,Widespread RNA and DNA sequence differences in the human transcriptome.,"Li, Mingyao; Wang, Isabel X; Li, Yun; Bruzel, Alan; Richards, Allison L; Toung, Jonathan M; Cheung, Vivian G",Science,TRUE
21602827,194,62.40,7.25,10.83,8.61,97.6,2011,Determinants of nucleosome organization in primary human cells.,"Valouev, Anton; Johnson, Steven M; Boyd, Scott D; Smith, Cheryl L; Fire, Andrew Z; Sidow, Arend",Nature,TRUE
21602919,40,12.87,6.25,9.01,2.06,75.6,2011,A comprehensive analysis of gene expression changes provoked by bacterial and fungal infection in C. elegans.,"Engelmann, Ilka; Griffon, Aurélien; Tichit, Laurent; Montañana-Sanchis, Frédéric; Wang, Guilin; Reinke, Valerie; Waterston, Robert H; Hillier, LaDeana W; Ewbank, Jonathan J",PLoS ONE,TRUE
21629277,37,11.90,5.14,6.97,2.31,79.1,2011,Mining for therapeutic gold.,"Collins, Francis S",Nat Rev Drug Discov,FALSE
21670498,80,25.73,6.12,8.77,4.21,91.4,2011,Progerin and telomere dysfunction collaborate to trigger cellular senescence in normal human fibroblasts.,"Cao, Kan; Blair, Cecilia D; Faddah, Dina A; Kieckhaefer, Julia E; Olive, Michelle; Erdos, Michael R; Nabel, Elizabeth G; Collins, Francis S",J. Clin. Invest.,TRUE
21685913,249,80.09,7.53,11.35,10.64,98.4,2011,CTCF-mediated functional chromatin interactome in pluripotent cells.,"Handoko, Lusy; Xu, Han; Li, Guoliang; Ngan, Chew Yee; Chew, Elaine; Schnapp, Marie; Lee, Charlie Wah Heng; Ye, Chaopeng; Ping, Joanne Lim Hui; Mulawadi, Fabianus; Wong, Eleanor; Sheng, Jianpeng; Zhang, Yubo; Poh, Thompson; Chan, Chee Seng; Kunarso, Galih; Shahab, Atif; Bourque, Guillaume; Cacheux-Rataboul, Valere; Sung, Wing-Kin; Ruan, Yijun; Wei, Chia-Lin",Nat. Genet.,TRUE
21700674,1090,350.60,3.69,4.31,94.98,99.9,2011,UCHIME improves sensitivity and speed of chimera detection.,"Edgar, Robert C; Haas, Brian J; Clemente, Jose C; Quince, Christopher; Knight, Rob",Bioinformatics,TRUE
21738485,58,18.66,5.42,7.48,3.44,88.2,2011,Genetic determinants of lipid traits in diverse populations from the population architecture using genomics and epidemiology (PAGE) study.,"Dumitrescu, Logan; Carty, Cara L; Taylor, Kira; Schumacher, Fredrick R; Hindorff, Lucia A; Ambite, José L; Anderson, Garnet; Best, Lyle G; Brown-Gentry, Kristin; B?ková, Petra; Carlson, Christopher S; Cochran, Barbara; Cole, Shelley A; Devereux, Richard B; Duggan, Dave; Eaton, Charles B; Fornage, Myriam; Franceschini, Nora; Haessler, Jeff; Howard, Barbara V; Johnson, Karen C; Laston, Sandra; Kolonel, Laurence N; Lee, Elisa T; MacCluer, Jean W; Manolio, Teri A; Pendergrass, Sarah A; Quibrera, Miguel; Shohet, Ralph V; Wilkens, Lynne R; Haiman, Christopher A; Le Marchand, Loïc; Buyske, Steven; Kooperberg, Charles; North, Kari E; Crawford, Dana C",PLoS Genet.,TRUE
21738677,4,1.29,5.10,6.90,0.25,12.8,2011,Integrated bio-entity network: a system for biological knowledge discovery.,"Bell, Lindsey; Chowdhary, Rajesh; Liu, Jun S; Niu, Xufeng; Zhang, Jinfeng",PLoS ONE,TRUE
21750108,43,13.83,5.91,8.39,2.34,79.4,2011,Loss of exon identity is a common mechanism of human inherited disease.,"Sterne-Weiler, Timothy; Howard, Jonathan; Mort, Matthew; Cooper, David N; Sanford, Jeremy R",Genome Res.,TRUE
21753854,286,91.99,5.31,7.28,17.32,99.4,2011,Selective killing of cancer cells by a small molecule targeting the stress response to ROS.,"Raj, Lakshmi; Ide, Takao; Gurkar, Aditi U; Foley, Michael; Schenone, Monica; Li, Xiaoyu; Tolliday, Nicola J; Golub, Todd R; Carr, Steven A; Shamji, Alykhan F; Stern, Andrew M; Mandinova, Anna; Schreiber, Stuart L; Lee, Sam W",Nature,TRUE
21775143,44,14.15,5.04,6.78,2.81,84,2011,Investigating the biological and clinical significance of human dysbioses.,"Frank, Daniel N; Zhu, Wei; Sartor, R Balfour; Li, Ellen",Trends Microbiol.,TRUE
21775991,33,10.61,6.16,8.84,1.72,70,2011,Analyses of X-linked and autosomal genetic variation in population-scale whole genome sequencing.,"Gottipati, Srikanth; Arbiza, Leonardo; Siepel, Adam; Clark, Andrew G; Keinan, Alon",Nat. Genet.,TRUE
21798897,481,154.71,5.79,8.16,26.74,99.7,2011,Exome sequencing of head and neck squamous cell carcinoma reveals inactivating mutations in NOTCH1.,"Agrawal, Nishant; Frederick, Mitchell J; Pickering, Curtis R; Bettegowda, Chetan; Chang, Kyle; Li, Ryan J; Fakhry, Carole; Xie, Tong-Xin; Zhang, Jiexin; Wang, Jing; Zhang, Nianxiang; El-Naggar, Adel K; Jasser, Samar A; Weinstein, John N; Treviño, Lisa; Drummond, Jennifer A; Muzny, Donna M; Wu, Yuanqing; Wood, Laura D; Hruban, Ralph H; Westra, William H; Koch, Wayne M; Califano, Joseph A; Gibbs, Richard A; Sidransky, David; Vogelstein, Bert; Velculescu, Victor E; Papadopoulos, Nickolas; Wheeler, David A; Kinzler, Kenneth W; Myers, Jeffrey N",Science,TRUE
21817873,26,8.36,4.32,5.47,1.94,73.8,2011,Is informed consent broken?,"Henderson, Gail E",Am. J. Med. Sci.,FALSE
21828269,6,1.93,7.47,11.24,0.26,13.2,2011,'Inc-miRs': functional intron-interrupted miRNA genes.,"Zhang, Huibin; Maniar, Jay M; Fire, Andrew Z",Genes Dev.,TRUE
21829391,33,10.61,5.35,7.35,1.99,74.5,2011,Hunger artists: yeast adapted to carbon limitation show trade-offs under carbon sufficiency.,"Wenger, Jared W; Piotrowski, Jeffrey; Nagarajan, Saisubramanian; Chiotti, Kami; Sherlock, Gavin; Rosenzweig, Frank",PLoS Genet.,TRUE
21840857,7,2.25,5.64,7.88,0.40,21.3,2011,Bayesian population genomic inference of crossing over and gene conversion.,"Padhukasahasram, Badri; Rannala, Bruce",Genetics,TRUE
21726042,28,9.01,4.18,5.21,2.15,77,2011,Rare-earth upconverting nanobarcodes for multiplexed biological detection.,"Zhang, Fan; Haushalter, Robert C; Haushalter, Robert W; Shi, Yifeng; Zhang, Yichi; Ding, Kunlun; Zhao, Dongyuan; Stucky, Galen D",Small,TRUE
21873549,89,28.63,5.77,8.12,4.96,93.5,2011,Genome-wide association identifies nine common variants associated with fasting proinsulin levels and provides new insights into the pathophysiology of type 2 diabetes.,"Strawbridge, Rona J; Dupuis, Josée; Prokopenko, Inga; Barker, Adam; Ahlqvist, Emma; Rybin, Denis; Petrie, John R; Travers, Mary E; Bouatia-Naji, Nabila; Dimas, Antigone S; Nica, Alexandra; Wheeler, Eleanor; Chen, Han; Voight, Benjamin F; Taneera, Jalal; Kanoni, Stavroula; Peden, John F; Turrini, Fabiola; Gustafsson, Stefan; Zabena, Carina; Almgren, Peter; Barker, David J P; Barnes, Daniel; Dennison, Elaine M; Eriksson, Johan G; Eriksson, Per; Eury, Elodie; Folkersen, Lasse; Fox, Caroline S; Frayling, Timothy M; Goel, Anuj; Gu, Harvest F; Horikoshi, Momoko; Isomaa, Bo; Jackson, Anne U; Jameson, Karen A; Kajantie, Eero; Kerr-Conte, Julie; Kuulasmaa, Teemu; Kuusisto, Johanna; Loos, Ruth J F; Luan, Jian'an; Makrilakis, Konstantinos; Manning, Alisa K; Martínez-Larrad, María Teresa; Narisu, Narisu; Nastase Mannila, Maria; Ohrvik, John; Osmond, Clive; Pascoe, Laura; Payne, Felicity; Sayer, Avan A; Sennblad, Bengt; Silveira, Angela; Stancáková, Alena; Stirrups, Kathy; Swift, Amy J; Syvänen, Ann-Christine; Tuomi, Tiinamaija; van 't Hooft, Ferdinand M; Walker, Mark; Weedon, Michael N; Xie, Weijia; Zethelius, Björn; ; ; ; ; ; Ongen, Halit; Mälarstig, Anders; Hopewell, Jemma C; Saleheen, Danish; Chambers, John; Parish, Sarah; Danesh, John; Kooner, Jaspal; Ostenson, Claes-Göran; Lind, Lars; Cooper, Cyrus C; Serrano-Ríos, Manuel; Ferrannini, Ele; Forsen, Tom J; Clarke, Robert; Franzosi, Maria Grazia; Seedorf, Udo; Watkins, Hugh; Froguel, Philippe; Johnson, Paul; Deloukas, Panos; Collins, Francis S; Laakso, Markku; Dermitzakis, Emmanouil T; Boehnke, Michael; McCarthy, Mark I; Wareham, Nicholas J; Groop, Leif; Pattou, François; Gloyn, Anna L; Dedoussis, George V; Lyssenko, Valeriya; Meigs, James B; Barroso, Inês; Watanabe, Richard M; Ingelsson, Erik; Langenberg, Claudia; Hamsten, Anders; Florez, Jose C",Diabetes,TRUE
21888368,15,4.82,4.31,5.45,1.12,54.3,2011,Origin of giant ionic currents in carbon nanotube channels.,"Pang, Pei; He, Jin; Park, Jae Hyun; Krsti?, Predrag S; Lindsay, Stuart",ACS Nano,TRUE
21890634,34,10.94,6.14,8.80,1.78,71.1,2011,Genomic analyses of the RNA-binding protein Hu antigen R (HuR) identify a complex network of target genes and novel characteristics of its binding sites.,"Uren, Philip J; Burns, Suzanne C; Ruan, Jianhua; Singh, Kusum K; Smith, Andrew D; Penalva, Luiz O F",J. Biol. Chem.,TRUE
21900194,51,16.40,7.22,10.78,2.27,78.6,2011,Genome-wide ChIP-Seq reveals a dramatic shift in the binding of the transcription factor erythroid Kruppel-like factor during erythrocyte differentiation.,"Pilon, Andre M; Ajay, Subramanian S; Kumar, Swathi Ashok; Steiner, Laurie A; Cherukuri, Praveen F; Wincovitch, Stephen; Anderson, Stacie M; ; Mullikin, James C; Gallagher, Patrick G; Hardison, Ross C; Margulies, Elliott H; Bodine, David M",Blood,TRUE
21907010,21,6.75,7.22,10.78,0.94,47.5,2011,Genome-wide comparison of African-ancestry populations from CARe and other cohorts reveals signals of natural selection.,"Bhatia, Gaurav; Patterson, Nick; Pasaniuc, Bogdan; Zaitlen, Noah; Genovese, Giulio; Pollack, Samuela; Mallick, Swapan; Myers, Simon; Tandon, Arti; Spencer, Chris; Palmer, Cameron D; Adeyemo, Adebowale A; Akylbekova, Ermeg L; Cupples, L Adrienne; Divers, Jasmin; Fornage, Myriam; Kao, W H Linda; Lange, Leslie; Li, Mingyao; Musani, Solomon; Mychaleckyj, Josyf C; Ogunniyi, Adesola; Papanicolaou, George; Rotimi, Charles N; Rotter, Jerome I; Ruczinski, Ingo; Salako, Babatunde; Siscovick, David S; Tayo, Bamidele O; Yang, Qiong; McCarroll, Steve; Sabeti, Pardis; Lettre, Guillaume; De Jager, Phil; Hirschhorn, Joel; Zhu, Xiaofeng; Cooper, Richard; Reich, David; Wilson, James G; Price, Alkes L",Am. J. Hum. Genet.,TRUE
21909108,64,20.59,5.77,8.12,3.57,88.8,2011,Meta-analysis of genome-wide association studies from the CHARGE consortium identifies common variants associated with carotid intima media thickness and plaque.,"Bis, Joshua C; Kavousi, Maryam; Franceschini, Nora; Isaacs, Aaron; Abecasis, Gonçalo R; Schminke, Ulf; Post, Wendy S; Smith, Albert V; Cupples, L Adrienne; Markus, Hugh S; Schmidt, Reinhold; Huffman, Jennifer E; Lehtimäki, Terho; Baumert, Jens; Münzel, Thomas; Heckbert, Susan R; Dehghan, Abbas; North, Kari; Oostra, Ben; Bevan, Steve; Stoegerer, Eva-Maria; Hayward, Caroline; Raitakari, Olli; Meisinger, Christa; Schillert, Arne; Sanna, Serena; Völzke, Henry; Cheng, Yu-Ching; Thorsson, Bolli; Fox, Caroline S; Rice, Kenneth; Rivadeneira, Fernando; Nambi, Vijay; Halperin, Eran; Petrovic, Katja E; Peltonen, Leena; Wichmann, H Erich; Schnabel, Renate B; Dörr, Marcus; Parsa, Afshin; Aspelund, Thor; Demissie, Serkalem; Kathiresan, Sekar; Reilly, Muredach P; Taylor, Kent; Uitterlinden, Andre; Couper, David J; Sitzer, Matthias; Kähönen, Mika; Illig, Thomas; Wild, Philipp S; Orru, Marco; Lüdemann, Jan; Shuldiner, Alan R; Eiriksdottir, Gudny; White, Charles C; Rotter, Jerome I; Hofman, Albert; Seissler, Jochen; Zeller, Tanja; Usala, Gianluca; Ernst, Florian; Launer, Lenore J; D'Agostino, Ralph B; O'Leary, Daniel H; Ballantyne, Christie; Thiery, Joachim; Ziegler, Andreas; Lakatta, Edward G; Chilukoti, Ravi Kumar; Harris, Tamara B; Wolf, Philip A; Psaty, Bruce M; Polak, Joseph F; Li, Xia; Rathmann, Wolfgang; Uda, Manuela; Boerwinkle, Eric; Klopp, Norman; Schmidt, Helena; Wilson, James F; Viikari, Jorma; Koenig, Wolfgang; Blankenberg, Stefan; Newman, Anne B; Witteman, Jacqueline; Heiss, Gerardo; Duijn, Cornelia van; Scuteri, Angelo; Homuth, Georg; Mitchell, Braxton D; Gudnason, Vilmundur; O'Donnell, Christopher J;",Nat. Genet.,TRUE
21917720,45,14.47,5.24,7.16,2.76,83.6,2011,Evaluation of HCD- and CID-type fragmentation within their respective detection platforms for murine phosphoproteomics.,"Jedrychowski, Mark P; Huttlin, Edward L; Haas, Wilhelm; Sowa, Mathew E; Rad, Ramin; Gygi, Steven P",Mol. Cell Proteomics,TRUE
21919205,8,2.57,4.04,4.95,0.64,34.1,2011,Identification of novel secreted proteases during extracellular proteolysis by dermatophytes at acidic pH.,"Sriranganadane, Dev; Waridel, Patrice; Salamin, Karine; Feuermann, Marc; Mignon, Bernard; Staib, Peter; Neuhaus, Jean-Marc; Quadroni, Manfredo; Monod, Michel",Proteomics,TRUE
21921583,9,2.89,5.41,7.47,0.53,28.8,2011,Karyotype differentiation between two stickleback species (Gasterosteidae).,"Urton, J R; McCann, S R; Peichel, C L",Cytogenet. Genome Res.,TRUE
21921926,115,36.99,6.04,8.63,6.12,95.5,2011,Haplotype phasing: existing methods and new developments.,"Browning, Sharon R; Browning, Brian L",Nat. Rev. Genet.,FALSE
21922541,31,9.97,6.70,9.82,1.49,64.9,2011,Using extreme phenotype sampling to identify the rare causal variants of quantitative traits in association studies.,"Li, Dalin; Lewinger, Juan Pablo; Gauderman, William J; Murcray, Cassandra Elizabeth; Conti, David",Genet. Epidemiol.,TRUE
21924933,104,33.45,7.43,11.17,4.50,92.3,2011,Directional DNA methylation changes and complex intermediate states accompany lineage specificity in the adult hematopoietic compartment.,"Hodges, Emily; Molaro, Antoine; Dos Santos, Camila O; Thekkat, Pramod; Song, Qiang; Uren, Philip J; Park, Jin; Butler, Jason; Rafii, Shahin; McCombie, W Richard; Smith, Andrew D; Hannon, Gregory J",Mol. Cell,TRUE
21949800,25,8.04,7.08,10.54,1.14,54.8,2011,Performance of genotype imputation for rare variants identified in exons and flanking regions of genes.,"Li, Li; Li, Yun; Browning, Sharon R; Browning, Brian L; Slater, Andrew J; Kong, Xiangyang; Aponte, Jennifer L; Mooser, Vincent E; Chissoe, Stephanie L; Whittaker, John C; Nelson, Matthew R; Ehm, Margaret Gelder",PLoS ONE,TRUE
21846742,3,0.96,4.78,6.31,0.20,10,2011,An SNP within the angiotensin-converting enzyme distinguishes between sprint and distance performing Alaskan sled dogs in a candidate gene analysis.,"Huson, Heather J; Byers, Alexandra M; Runstadler, Jonathan; Ostrander, Elaine A",J. Hered.,TRUE
21852396,40,12.87,5.97,8.49,2.16,77,2011,HNF4A is essential for specification of hepatic progenitors from human pluripotent stem cells.,"DeLaForest, Ann; Nagaoka, Masato; Si-Tayeb, Karim; Noto, Fallon K; Konopka, Genevieve; Battle, Michele A; Duncan, Stephen A",Development,TRUE
21852959,94,30.23,6.39,9.27,4.73,93,2011,Analysis of DNA methylation in a three-generation family reveals widespread genetic influence on epigenetic regulation.,"Gertz, Jason; Varley, Katherine E; Reddy, Timothy E; Bowling, Kevin M; Pauli, Florencia; Parker, Stephanie L; Kucera, Katerina S; Willard, Huntington F; Myers, Richard M",PLoS Genet.,TRUE
21992004,8,3.79,6.15,8.05,0.62,33.1,2012,Selective aurora kinase inhibitors identified using a taxol-induced checkpoint sensitivity screen.,"Kwiatkowski, Nicholas; Deng, Xianming; Wang, Jinhua; Tan, Li; Villa, Fabrizio; Santaguida, Stefano; Huang, Hsiao-Chun; Mitchison, Tim; Musacchio, Andrea; Gray, Nathanael",ACS Chem. Biol.,TRUE
21994220,21,6.75,6.21,8.93,1.09,53.2,2011,FlyExpress: visual mining of spatiotemporal patterns for genes and publications in Drosophila embryogenesis.,"Kumar, Sudhir; Konikoff, Charlotte; Van Emden, Bernard; Busick, Christopher; Davis, Kailah T; Ji, Shuiwang; Wu, Lin-Wei; Ramos, Hector; Brody, Thomas; Panchanathan, Sethuraman; Ye, Jieping; Karr, Timothy L; Gerold, Kristyn; McCutchan, Michael; Newfeld, Stuart J",Bioinformatics,TRUE
21998595,34,10.94,6.76,9.95,1.62,67.8,2011,"Identification, replication, and fine-mapping of Loci associated with adult height in individuals of african ancestry.","N'Diaye, Amidou; Chen, Gary K; Palmer, Cameron D; Ge, Bing; Tayo, Bamidele; Mathias, Rasika A; Ding, Jingzhong; Nalls, Michael A; Adeyemo, Adebowale; Adoue, Véronique; Ambrosone, Christine B; Atwood, Larry; Bandera, Elisa V; Becker, Lewis C; Berndt, Sonja I; Bernstein, Leslie; Blot, William J; Boerwinkle, Eric; Britton, Angela; Casey, Graham; Chanock, Stephen J; Demerath, Ellen; Deming, Sandra L; Diver, W Ryan; Fox, Caroline; Harris, Tamara B; Hernandez, Dena G; Hu, Jennifer J; Ingles, Sue A; John, Esther M; Johnson, Craig; Keating, Brendan; Kittles, Rick A; Kolonel, Laurence N; Kritchevsky, Stephen B; Le Marchand, Loic; Lohman, Kurt; Liu, Jiankang; Millikan, Robert C; Murphy, Adam; Musani, Solomon; Neslund-Dudas, Christine; North, Kari E; Nyante, Sarah; Ogunniyi, Adesola; Ostrander, Elaine A; Papanicolaou, George; Patel, Sanjay; Pettaway, Curtis A; Press, Michael F; Redline, Susan; Rodriguez-Gil, Jorge L; Rotimi, Charles; Rybicki, Benjamin A; Salako, Babatunde; Schreiner, Pamela J; Signorello, Lisa B; Singleton, Andrew B; Stanford, Janet L; Stram, Alex H; Stram, Daniel O; Strom, Sara S; Suktitipat, Bhoom; Thun, Michael J; Witte, John S; Yanek, Lisa R; Ziegler, Regina G; Zheng, Wei; Zhu, Xiaofeng; Zmuda, Joseph M; Zonderman, Alan B; Evans, Michele K; Liu, Yongmei; Becker, Diane M; Cooper, Richard S; Pastinen, Tomi; Henderson, Brian E; Hirschhorn, Joel N; Lettre, Guillaume; Haiman, Christopher A",PLoS Genet.,TRUE
22004471,47,22.29,4.99,6.32,4.46,92.2,2012,Genome-wide significant association between alcohol dependence and a variant in the ADH gene cluster.,"Frank, Josef; Cichon, Sven; Treutlein, Jens; Ridinger, Monika; Mattheisen, Manuel; Hoffmann, Per; Herms, Stefan; Wodarz, Norbert; Soyka, Michael; Zill, Peter; Maier, Wolfgang; Mössner, Rainald; Gaebel, Wolfgang; Dahmen, Norbert; Scherbaum, Norbert; Schmäl, Christine; Steffens, Michael; Lucae, Susanne; Ising, Marcus; Müller-Myhsok, Bertram; Nöthen, Markus M; Mann, Karl; Kiefer, Falk; Rietschel, Marcella",Addict Biol,TRUE
22025670,7,2.25,5.82,8.22,0.39,20.5,2011,Critical amino acid residues in proteins: a BioMart integration of Reactome protein annotations with PRIDE mass spectrometry data and COSMIC somatic mutations.,"Ndegwa, Nelson; Côté, Richard G; Ovelleiro, David; D'Eustachio, Peter; Hermjakob, Henning; Vizcaíno, Juan A; Croft, David",Database (Oxford),TRUE
22026483,9,2.89,4.71,6.19,0.61,33,2011,In situ electronic characterization of graphene nanoconstrictions fabricated in a transmission electron microscope.,"Lu, Ye; Merchant, Christopher A; Drndi?, Marija; Johnson, A T Charlie",Nano Lett.,TRUE
22028097,55,17.69,3.07,3.18,5.76,95,2011,Noninvasive prenatal diagnosis: pregnant women's interest and expected uptake.,"Tischler, Reana; Hudgins, Louanne; Blumenfeld, Yair J; Greely, Henry T; Ormond, Kelly E",Prenat. Diagn.,TRUE
22036573,162,52.11,6.69,9.81,7.79,97.1,2011,A protein complex network of Drosophila melanogaster.,"Guruharsha, K G; Rual, Jean-François; Zhai, Bo; Mintseris, Julian; Vaidya, Pujita; Vaidya, Namita; Beekman, Chapman; Wong, Christina; Rhee, David Y; Cenaj, Odise; McKillip, Emily; Shah, Saumini; Stapleton, Mark; Wan, Kenneth H; Yu, Charles; Parsa, Bayan; Carlson, Joseph W; Chen, Xiao; Kapadia, Bhaveen; VijayRaghavan, K; Gygi, Steven P; Celniker, Susan E; Obar, Robert A; Artavanis-Tsakonas, Spyros",Cell,TRUE
22074947,10,4.74,6.19,8.12,0.77,40.3,2012,Research resource: enhanced genome-wide occupancy of estrogen receptor ? by the cochaperone p23 in breast cancer cells.,"Simpson, Natalie E; Gertz, Jason; Imberg, Keren; Myers, Richard M; Garabedian, Michael J",Mol. Endocrinol.,TRUE
22101970,70,33.19,5.76,7.47,5.76,95,2012,Use of diverse electronic medical record systems to identify genetic risk for type 2 diabetes within a genome-wide association study.,"Kho, Abel N; Hayes, M Geoffrey; Rasmussen-Torvik, Laura; Pacheco, Jennifer A; Thompson, William K; Armstrong, Loren L; Denny, Joshua C; Peissig, Peggy L; Miller, Aaron W; Wei, Wei-Qi; Bielinski, Suzette J; Chute, Christopher G; Leibson, Cynthia L; Jarvik, Gail P; Crosslin, David R; Carlson, Christopher S; Newton, Katherine M; Wolf, Wendy A; Chisholm, Rex L; Lowe, William L",J Am Med Inform Assoc,TRUE
22102583,30,14.22,6.16,8.06,2.31,79,2012,Mouse Phenome Database (MPD).,"Maddatu, Terry P; Grubb, Stephen C; Bult, Carol J; Bogue, Molly A",Nucleic Acids Res.,TRUE
22105877,6,2.84,4.96,6.27,0.57,30.9,2012,Genome-wide association studies for multiple diseases of the German Shepherd Dog.,"Tsai, Kate L; Noorai, Rooksana E; Starr-Moss, Alison N; Quignon, Pascale; Rinz, Caitlin J; Ostrander, Elaine A; Steiner, Jörg M; Murphy, Keith E; Clark, Leigh Anne",Mamm. Genome,TRUE
21976454,7,2.25,4.81,6.36,0.47,25.1,2011,A broad range of ophthalmologic anomalies is part of the holoprosencephaly spectrum.,"Pineda-Alvarez, Daniel E; Solomon, Benjamin D; Roessler, Erich; Balog, Joan Z; Hadley, Donald W; Zein, Wadih M; Hadsall, Casey K; Brooks, Brian P; Muenke, Maximilian",Am. J. Med. Genet. A,TRUE
21980307,49,15.76,6.34,9.17,2.49,81,2011,MicroRNA predictors of longevity in Caenorhabditis elegans.,"Pincus, Zachary; Smith-Vikos, Thalyana; Slack, Frank J",PLoS Genet.,TRUE
22117901,4,1.90,3.82,4.56,0.50,26.7,2012,Utility-aware screening with clique-oriented prioritization.,"Swamidass, S Joshua; Calhoun, Bradley T; Bittker, Joshua A; Bodycombe, Nicole E; Clemons, Paul A",J Chem Inf Model,TRUE
22119407,20,9.48,5.55,7.15,1.71,69.7,2012,Genetic association and gene-gene interaction analyses in African American dialysis patients with nondiabetic nephropathy.,"Bostrom, Meredith A; Kao, W H Linda; Li, Man; Abboud, Hanna E; Adler, Sharon G; Iyengar, Sudha K; Kimmel, Paul L; Hanson, Robert L; Nicholas, Susanne B; Rasooly, Rebekah S; Sedor, John R; Coresh, Josef; Kohn, Orly F; Leehey, David J; Thornley-Brown, Denyse; Bottinger, Erwin P; Lipkowitz, Michael S; Meoni, Lucy A; Klag, Michael J; Lu, Lingyi; Hicks, Pamela J; Langefeld, Carl D; Parekh, Rulan S; Bowden, Donald W; Freedman, Barry I;",Am. J. Kidney Dis.,TRUE
22143773,24,7.72,5.30,7.26,1.46,64.1,2011,Regulation of phenotypic heterogeneity permits Salmonella evasion of the host caspase-1 inflammatory response.,"Stewart, Mary K; Cummings, Lisa A; Johnson, Matthew L; Berezow, Alex B; Cookson, Brad T",Proc. Natl. Acad. Sci. U.S.A.,TRUE
22144914,24,7.72,6.17,8.86,1.25,58.5,2011,Charcot-Marie-Tooth-linked mutant GARS is toxic to peripheral neurons independent of wild-type GARS levels.,"Motley, William W; Seburn, Kevin L; Nawaz, Mir Hussain; Miers, Kathy E; Cheng, Jun; Antonellis, Anthony; Green, Eric D; Talbot, Kevin; Yang, Xiang-Lei; Fischbeck, Kenneth H; Burgess, Robert W",PLoS Genet.,TRUE
22150006,336,108.07,6.54,9.54,16.53,99.3,2011,SF3B1 and other novel cancer genes in chronic lymphocytic leukemia.,"Wang, Lili; Lawrence, Michael S; Wan, Youzhong; Stojanov, Petar; Sougnez, Carrie; Stevenson, Kristen; Werner, Lillian; Sivachenko, Andrey; DeLuca, David S; Zhang, Li; Zhang, Wandi; Vartanov, Alexander R; Fernandes, Stacey M; Goldstein, Natalie R; Folco, Eric G; Cibulskis, Kristian; Tesar, Bethany; Sievers, Quinlan L; Shefler, Erica; Gabriel, Stacey; Hacohen, Nir; Reed, Robin; Meyerson, Matthew; Golub, Todd R; Lander, Eric S; Neuberg, Donna; Brown, Jennifer R; Getz, Gad; Wu, Catherine J",N. Engl. J. Med.,TRUE
22151854,3,0.96,4.24,5.33,0.23,11.4,2011,Sequencing by ligation variation with endonuclease V digestion and deoxyinosine-containing query oligonucleotides.,"Ho, Antoine; Murphy, Maurice; Wilson, Susan; Atlas, Susan R; Edwards, Jeremy S",BMC Genomics,TRUE
22153072,101,32.49,6.91,10.21,4.70,92.9,2011,Cofactor binding evokes latent differences in DNA binding specificity between Hox proteins.,"Slattery, Matthew; Riley, Todd; Liu, Peng; Abe, Namiko; Gomez-Alcala, Pilar; Dror, Iris; Zhou, Tianyin; Rohs, Remo; Honig, Barry; Bussemaker, Harmen J; Mann, Richard S",Cell,TRUE
22160768,1,0.47,5.54,7.15,0.09,4.3,2012,Does history repeat itself? Wavelets and the phylodynamics of influenza A.,"Tom, Jennifer A; Sinsheimer, Janet S; Suchard, Marc A",Mol. Biol. Evol.,TRUE
22179855,34,16.12,6.89,9.16,2.34,79.4,2012,Cooperation between Polycomb and androgen receptor during oncogenic transformation.,"Zhao, Jonathan C; Yu, Jianjun; Runkle, Christine; Wu, Longtao; Hu, Ming; Wu, Dayong; Liu, Jun S; Wang, Qianben; Qin, Zhaohui S; Yu, Jindan",Genome Res.,TRUE
