22853913,12,5.69,4.24,5.20,1.34,61,2012,Trapping DNA near a solid-state nanopore.,"Vlassarev, Dimitar M; Golovchenko, Jene A",Biophys. J.,TRUE
22933317,1,0.90,1.77,1.34,0.51,27.4,2013,Adaptive linear rank tests for eQTL studies.,"Szymczak, Silke; Scheinhardt, Markus O; Zeller, Tanja; Wild, Philipp S; Blankenberg, Stefan; Ziegler, Andreas",Stat Med,TRUE
22939624,148,70.18,6.72,8.90,10.45,98.4,2012,Quantitative analysis of HSP90-client interactions reveals principles of substrate recognition.,"Taipale, Mikko; Krykbaeva, Irina; Koeva, Martina; Kayatekin, Can; Westover, Kenneth D; Karras, Georgios I; Lindquist, Susan",Cell,TRUE
22955617,555,263.16,7.74,10.44,33.99,99.8,2012,The accessible chromatin landscape of the human genome.,"Thurman, Robert E; Rynes, Eric; Humbert, Richard; Vierstra, Jeff; Maurano, Matthew T; Haugen, Eric; Sheffield, Nathan C; Stergachis, Andrew B; Wang, Hao; Vernot, Benjamin; Garg, Kavita; John, Sam; Sandstrom, Richard; Bates, Daniel; Boatman, Lisa; Canfield, Theresa K; Diegel, Morgan; Dunn, Douglas; Ebersol, Abigail K; Frum, Tristan; Giste, Erika; Johnson, Audra K; Johnson, Ericka M; Kutyavin, Tanya; Lajoie, Bryan; Lee, Bum-Kyu; Lee, Kristen; London, Darin; Lotakis, Dimitra; Neph, Shane; Neri, Fidencio; Nguyen, Eric D; Qu, Hongzhu; Reynolds, Alex P; Roach, Vaughn; Safi, Alexias; Sanchez, Minerva E; Sanyal, Amartya; Shafer, Anthony; Simon, Jeremy M; Song, Lingyun; Vong, Shinny; Weaver, Molly; Yan, Yongqi; Zhang, Zhancheng; Zhang, Zhuzhu; Lenhard, Boris; Tewari, Muneesh; Dorschner, Michael O; Hansen, R Scott; Navas, Patrick A; Stamatoyannopoulos, George; Iyer, Vishwanath R; Lieb, Jason D; Sunyaev, Shamil R; Akey, Joshua M; Sabo, Peter J; Kaul, Rajinder; Furey, Terrence S; Dekker, Job; Crawford, Gregory E; Stamatoyannopoulos, John A",Nature,TRUE
22955987,459,217.64,7.08,9.44,30.74,99.8,2012,GENCODE: the reference human genome annotation for The ENCODE Project.,"Harrow, Jennifer; Frankish, Adam; Gonzalez, Jose M; Tapanari, Electra; Diekhans, Mark; Kokocinski, Felix; Aken, Bronwen L; Barrell, Daniel; Zadissa, Amonida; Searle, Stephen; Barnes, If; Bignell, Alexandra; Boychenko, Veronika; Hunt, Toby; Kay, Mike; Mukherjee, Gaurab; Rajan, Jeena; Despacio-Reyes, Gloria; Saunders, Gary; Steward, Charles; Harte, Rachel; Lin, Michael; Howald, Cédric; Tanzer, Andrea; Derrien, Thomas; Chrast, Jacqueline; Walters, Nathalie; Balasubramanian, Suganthi; Pei, Baikang; Tress, Michael; Rodriguez, Jose Manuel; Ezkurdia, Iakes; van Baren, Jeltje; Brent, Michael; Haussler, David; Kellis, Manolis; Valencia, Alfonso; Reymond, Alexandre; Gerstein, Mark; Guigó, Roderic; Hubbard, Tim J",Genome Res.,TRUE
23028187,4,3.61,8.68,9.34,0.42,22.2,2013,Haplotype-based profiling of subtle allelic imbalance with SNP arrays.,"Vattathil, Selina; Scheet, Paul",Genome Res.,TRUE
22904687,55,26.08,5.63,7.27,4.64,92.7,2012,The Human Microbiome Project: a community resource for the healthy human microbiome.,"Gevers, Dirk; Knight, Rob; Petrosino, Joseph F; Huang, Katherine; McGuire, Amy L; Birren, Bruce W; Nelson, Karen E; White, Owen; Methé, Barbara A; Huttenhower, Curtis",PLoS Biol.,TRUE
22912405,19,9.01,6.62,8.75,1.36,61.6,2012,Identification of benzodiazepine Ro5-3335 as an inhibitor of CBF leukemia through quantitative high throughput screen against RUNX1-CBF? interaction.,"Cunningham, Lea; Finckbeiner, Steven; Hyde, R Katherine; Southall, Noel; Marugan, Juan; Yedavalli, Venkat R K; Dehdashti, Seameen Jean; Reinhold, William C; Alemu, Lemlem; Zhao, Ling; Yeh, Jing-Ruey Joanna; Sood, Raman; Pommier, Yves; Austin, Christopher P; Jeang, Kuan-Teh; Zheng, Wei; Liu, Paul",Proc. Natl. Acad. Sci. U.S.A.,TRUE
22923467,26,23.44,6.70,7.04,3.50,88.5,2013,The timing of pigmentation lightening in Europeans.,"Beleza, Sandra; Santos, António M; McEvoy, Brian; Alves, Isabel; Martinho, Cláudia; Cameron, Emily; Shriver, Mark D; Parra, Esteban J; Rocha, Jorge",Mol. Biol. Evol.,TRUE
22983436,17,8.06,4.46,5.53,1.81,71.5,2012,"Capture, isolation and release of cancer cells with aptamer-functionalized glass bead array.","Wan, Yuan; Liu, Yaling; Allen, Peter B; Asghar, Waseem; Mahmood, M Arif Iftakher; Tan, Jifu; Duhon, Holli; Kim, Young-tae; Ellington, Andrew D; Iqbal, Samir M",Lab Chip,TRUE
22987818,8,3.79,6.99,9.31,0.54,29.2,2012,WDR35 mutation in siblings with Sensenbrenner syndrome: a ciliopathy with variable phenotype.,"Bacino, Carlos A; Dhar, Shweta U; Brunetti-Pierri, Nicola; Lee, Brendan; Bonnen, Penelope E",Am. J. Med. Genet. A,TRUE
22995991,48,43.28,7.73,8.23,5.60,94.8,2013,An informatics approach to analyzing the incidentalome.,"Berg, Jonathan S; Adams, Michael; Nassar, Nassib; Bizon, Chris; Lee, Kristy; Schmitt, Charles P; Wilhelmsen, Kirk C; Evans, James P",Genet. Med.,TRUE
23024010,28,13.28,7.89,10.65,1.68,69.2,2012,Site identification in high-throughput RNA-protein interaction data.,"Uren, Philip J; Bahrami-Samani, Emad; Burns, Suzanne C; Qiao, Mei; Karginov, Fedor V; Hodges, Emily; Hannon, Gregory J; Sanford, Jeremy R; Penalva, Luiz O F; Smith, Andrew D",Bioinformatics,TRUE
23044549,6,5.41,6.86,7.23,0.79,41.3,2013,MGAviewer: a desktop visualization tool for analysis of metagenomics alignment data.,"Zhu, Zhengwei; Niu, Beifang; Chen, Jing; Wu, Sitao; Sun, Shulei; Li, Weizhong",Bioinformatics,TRUE
23062576,3,1.42,6.77,8.98,0.21,10.5,2012,Cellular calibrators to quantitate T-cell receptor excision circles (TRECs) in clinical samples.,"Punwani, Divya; Gonzalez-Espinosa, Diana; Comeau, Anne Marie; Dutra, Amalia; Pak, Evgenia; Puck, Jennifer",Mol. Genet. Metab.,TRUE
23064000,13,6.16,4.85,6.11,1.27,59,2012,A counting renaissance: combining stochastic mapping and empirical Bayes to quickly detect amino acid sites under positive selection.,"Lemey, Philippe; Minin, Vladimir N; Bielejec, Filip; Kosakovsky Pond, Sergei L; Suchard, Marc A",Bioinformatics,TRUE
23088656,16,7.59,6.64,8.79,1.14,55,2012,Gene expression anti-profiles as a basis for accurate universal cancer signatures.,"Bravo, Héctor Corrada; Pihur, Vasyl; McCall, Matthew; Irizarry, Rafael A; Leek, Jeffrey T",BMC Bioinformatics,TRUE
23103170,24,11.38,7.26,9.71,1.57,66.7,2012,Large-scale functional organization of long-range chromatin interaction networks.,"Sandhu, Kuljeet Singh; Li, Guoliang; Poh, Huay Mei; Quek, Yu Ling Kelly; Sia, Yee Yen; Peh, Su Qin; Mulawadi, Fabianus Hendriyan; Lim, Joanne; Sikic, Mile; Menghi, Francesca; Thalamuthu, Anbupalam; Sung, Wing Kin; Ruan, Xiaoan; Fullwood, Melissa Jane; Liu, Edison; Csermely, Peter; Ruan, Yijun",Cell Rep,TRUE
23104156,2,1.80,5.73,5.92,0.32,16.4,2013,Proliferation and migration of tumor cells in tapered channels.,"Wan, Yuan; Tamuly, Deepika; Allen, Peter B; Kim, Young-tae; Bachoo, Robert; Ellington, Andrew D; Iqbal, Samir M",Biomed Microdevices,TRUE
23106705,29,13.75,5.80,7.53,2.37,79.8,2012,Genomic basis of aging and life-history evolution in Drosophila melanogaster.,"Remolina, Silvia C; Chang, Peter L; Leips, Jeff; Nuzhdin, Sergey V; Hughes, Kimberly A",Evolution,TRUE
23114012,11,5.22,6.91,9.18,0.76,39.8,2012,Multiparameter behavioral profiling reveals distinct thermal response regimes in Caenorhabditis elegans.,"Ghosh, Rajarshi; Mohammadi, Aylia; Kruglyak, Leonid; Ryu, William S",BMC Biol.,TRUE
23038411,4,1.90,6.49,8.56,0.29,15.1,2012,The robustness of generalized estimating equations for association tests in extended family data.,"Suktitipat, Bhoom; Mathias, Rasika A; Vaidya, Dhananjay; Yanek, Lisa R; Young, J Hunter; Becker, Lewis C; Becker, Diane M; Wilson, Alexander F; Fallin, M Daniele",Hum. Hered.,TRUE
23043118,35,16.60,7.54,10.13,2.20,77.6,2012,Extensive genetic variation in somatic human tissues.,"O'Huallachain, Maeve; Karczewski, Konrad J; Weissman, Sherman M; Urban, Alexander Eckehart; Snyder, Michael P",Proc. Natl. Acad. Sci. U.S.A.,TRUE
23074187,23,20.74,7.01,7.40,2.96,85.2,2013,"ZFIN, the Zebrafish Model Organism Database: increased support for mutants and transgenics.","Howe, Douglas G; Bradford, Yvonne M; Conlin, Tom; Eagle, Anne E; Fashena, David; Frazer, Ken; Knight, Jonathan; Mani, Prita; Martin, Ryan; Moxon, Sierra A Taylor; Paddock, Holly; Pich, Christian; Ramachandran, Sridhar; Ruef, Barbara J; Ruzicka, Leyla; Schaper, Kevin; Shao, Xiang; Singer, Amy; Sprunger, Brock; Van Slyke, Ceri E; Westerfield, Monte",Nucleic Acids Res.,TRUE
23160062,5,2.37,5.86,7.62,0.40,21.5,2012,Population genomic analysis of base composition evolution in Drosophila melanogaster.,"Poh, Yu-Ping; Ting, Chau-Ti; Fu, Hua-Wen; Langley, Charles H; Begun, David J",Genome Biol Evol,TRUE
23162081,4,3.61,6.52,6.84,0.55,29.7,2013,A system for exact and approximate genetic linkage analysis of SNP data in large pedigrees.,"Silberstein, Mark; Weissbrod, Omer; Otten, Lars; Tzemach, Anna; Anisenia, Andrei; Shtark, Oren; Tuberg, Dvir; Galfrin, Eddie; Gannon, Irena; Shalata, Adel; Borochowitz, Zvi U; Dechter, Rina; Thompson, Elizabeth; Geiger, Dan",Bioinformatics,TRUE
23166519,0,0.00,6.56,8.66,0.00,2,2012,A unified method for detecting secondary trait associations with rare variants: application to sequence data.,"Liu, Dajiang J; Leal, Suzanne M",PLoS Genet.,TRUE
23172852,21,18.94,5.88,6.10,3.22,86.9,2013,The relationship between F(ST) and the frequency of the most frequent allele.,"Jakobsson, Mattias; Edge, Michael D; Rosenberg, Noah A",Genetics,TRUE
23176082,3,1.42,7.86,10.61,0.18,8.9,2012,Weighted pedigree-based statistics for testing the association of rare variants.,"Shugart, Yin Yao; Zhu, Yun; Guo, Wei; Xiong, Momiao",BMC Genomics,TRUE
23180580,25,22.54,5.95,6.17,3.79,89.9,2013,Improving Bayesian population dynamics inference: a coalescent-based model for multiple loci.,"Gill, Mandev S; Lemey, Philippe; Faria, Nuno R; Rambaut, Andrew; Shapiro, Beth; Suchard, Marc A",Mol. Biol. Evol.,TRUE
23181507,4,1.90,7.67,10.32,0.25,12.6,2012,"CloudMan as a platform for tool, data, and analysis distribution.","Afgan, Enis; Chapman, Brad; Taylor, James",BMC Bioinformatics,TRUE
23195121,8,3.79,6.01,7.85,0.63,33.8,2012,The neurobehavior ontology: an ontology for annotation and integration of behavior and behavioral phenotypes.,"Gkoutos, Georgios V; Schofield, Paul N; Hoehndorf, Robert",Int. Rev. Neurobiol.,FALSE
23203985,33,29.76,7.95,8.48,3.75,89.7,2013,Dfam: a database of repetitive DNA based on profile hidden Markov models.,"Wheeler, Travis J; Clements, Jody; Eddy, Sean R; Hubley, Robert; Jones, Thomas A; Jurka, Jerzy; Smit, Arian F A; Finn, Robert D",Nucleic Acids Res.,TRUE
23203987,480,432.83,7.87,8.40,54.98,99.9,2013,Ensembl 2013.,"Flicek, Paul; Ahmed, Ikhlak; Amode, M Ridwan; Barrell, Daniel; Beal, Kathryn; Brent, Simon; Carvalho-Silva, Denise; Clapham, Peter; Coates, Guy; Fairley, Susan; Fitzgerald, Stephen; Gil, Laurent; García-Girón, Carlos; Gordon, Leo; Hourlier, Thibaut; Hunt, Sarah; Juettemann, Thomas; Kähäri, Andreas K; Keenan, Stephen; Komorowska, Monika; Kulesha, Eugene; Longden, Ian; Maurel, Thomas; McLaren, William M; Muffato, Matthieu; Nag, Rishi; Overduin, Bert; Pignatelli, Miguel; Pritchard, Bethan; Pritchard, Emily; Riat, Harpreet Singh; Ritchie, Graham R S; Ruffier, Magali; Schuster, Michael; Sheppard, Daniel; Sobral, Daniel; Taylor, Kieron; Thormann, Anja; Trevanion, Stephen; White, Simon; Wilder, Steven P; Aken, Bronwen L; Birney, Ewan; Cunningham, Fiona; Dunham, Ian; Harrow, Jennifer; Herrero, Javier; Hubbard, Tim J P; Johnson, Nathan; Kinsella, Rhoda; Parker, Anne; Spudich, Giulietta; Yates, Andy; Zadissa, Amonida; Searle, Stephen M J",Nucleic Acids Res.,TRUE
23129628,24,11.38,5.06,6.42,2.25,78.3,2012,Estimating divergence times in large molecular phylogenies.,"Tamura, Koichiro; Battistuzzi, Fabia Ursula; Billing-Ross, Paul; Murillo, Oscar; Filipski, Alan; Kumar, Sudhir",Proc. Natl. Acad. Sci. U.S.A.,TRUE
23129635,17,8.06,7.00,9.33,1.15,55.3,2012,Background-dependent effects of polyglutamine variation in the Arabidopsis thaliana gene ELF3.,"Undurraga, Soledad Francisca; Press, Maximilian Oliver; Legendre, Matthieu; Bujdoso, Nora; Bale, Jacob; Wang, Hui; Davis, Seth J; Verstrepen, Kevin J; Queitsch, Christine",Proc. Natl. Acad. Sci. U.S.A.,TRUE
23136140,25,22.54,7.15,7.56,3.15,86.5,2013,Genetic susceptibility loci for subtypes of breast cancer in an African American population.,"Palmer, Julie R; Ruiz-Narvaez, Edward A; Rotimi, Charles N; Cupples, L Adrienne; Cozier, Yvette C; Adams-Campbell, Lucile L; Rosenberg, Lynn",Cancer Epidemiol. Biomarkers Prev.,TRUE
23254888,8,7.21,3.00,2.76,2.41,80.2,2013,Bioactivity and bioavailability of ginsenosides are dependent on the glycosidase activities of the A/J mouse intestinal microbiome defined by pyrosequencing.,"Niu, Tao; Smith, Diane L; Yang, Zhen; Gao, Song; Yin, Taijun; Jiang, Zhi-Hong; You, Ming; Gibbs, Richard A; Petrosino, Joseph F; Hu, Ming",Pharm. Res.,TRUE
23258891,149,70.65,7.18,9.59,9.84,98.2,2012,Evolutionary dynamics of gene and isoform regulation in Mammalian tissues.,"Merkin, Jason; Russell, Caitlin; Chen, Ping; Burge, Christopher B",Science,TRUE
23259840,19,17.13,5.08,5.17,3.37,87.8,2013,pH tuning of DNA translocation time through organically functionalized nanopores.,"Anderson, Brett N; Muthukumar, Murugappan; Meller, Amit",ACS Nano,TRUE
23209389,11,5.22,5.85,7.60,0.89,45.8,2012,Bioinformatics for the Human Microbiome Project.,"Gevers, Dirk; Pop, Mihai; Schloss, Patrick D; Huttenhower, Curtis",PLoS Comput. Biol.,TRUE
20186266,369,89.80,4.54,6.34,19.77,99.5,2010,Genome sequence of the pea aphid Acyrthosiphon pisum.,,PLoS Biol.,TRUE
23138292,104,49.31,6.75,8.96,7.30,96.8,2012,Assuring the quality of next-generation sequencing in clinical laboratory practice.,"Gargis, Amy S; Kalman, Lisa; Berry, Meredith W; Bick, David P; Dimmock, David P; Hambuch, Tina; Lu, Fei; Lyon, Elaine; Voelkerding, Karl V; Zehnbauer, Barbara A; Agarwala, Richa; Bennett, Sarah F; Chen, Bin; Chin, Ephrem L H; Compton, John G; Das, Soma; Farkas, Daniel H; Ferber, Matthew J; Funke, Birgit H; Furtado, Manohar R; Ganova-Raeva, Lilia M; Geigenmüller, Ute; Gunselman, Sandra J; Hegde, Madhuri R; Johnson, Philip L F; Kasarskis, Andrew; Kulkarni, Shashikant; Lenk, Thomas; Liu, C S Jonathan; Manion, Megan; Manolio, Teri A; Mardis, Elaine R; Merker, Jason D; Rajeevan, Mangalathu S; Reese, Martin G; Rehm, Heidi L; Simen, Birgitte B; Yeakley, Joanne M; Zook, Justin M; Lubin, Ira M",Nat. Biotechnol.,TRUE
23140825,30,27.05,4.78,4.82,5.66,94.9,2013,"Beyond gel electrophoresis: microfluidic separations, fluorescence burst analysis, and DNA stretching.","Dorfman, Kevin D; King, Scott B; Olson, Daniel W; Thomas, Joel D P; Tree, Douglas R",Chem. Rev.,FALSE
23144463,24,11.38,7.23,9.67,1.57,66.9,2012,The Wnt coreceptor Ryk regulates Wnt/planar cell polarity by modulating the degradation of the core planar cell polarity component Vangl2.,"Andre, Philipp; Wang, Qianyi; Wang, Na; Gao, Bo; Schilit, Arielle; Halford, Michael M; Stacker, Steven A; Zhang, Xuemin; Yang, Yingzi",J. Biol. Chem.,TRUE
23300412,7,3.32,7.50,10.07,0.44,23.7,2012,Chapter 6: Structural variation and medical genomics.,"Raphael, Benjamin J",PLoS Comput. Biol.,TRUE
23306801,11,9.92,5.91,6.13,1.68,69,2013,The arrival of genomic medicine to the clinic is only the beginning of the journey.,"Evans, James P; Khoury, Muin J",Genet. Med.,FALSE
23307558,16,14.43,7.83,8.35,1.84,72.2,2013,Rbm20 regulates titin alternative splicing as a splicing repressor.,"Li, Shijun; Guo, Wei; Dewey, Colin N; Greaser, Marion L",Nucleic Acids Res.,TRUE
23308248,12,10.82,6.60,6.93,1.64,68.3,2013,"Extent of linkage disequilibrium in the domestic cat, Felis silvestris catus, and its breeds.","Alhaddad, Hasan; Khan, Razib; Grahn, Robert A; Gandolfi, Barbara; Mullikin, James C; Cole, Shelley A; Gruffydd-Jones, Timothy J; Häggström, Jens; Lohi, Hannes; Longeri, Maria; Lyons, Leslie A",PLoS ONE,TRUE
23325432,123,110.91,8.94,9.63,12.41,98.8,2013,Dynamic DNA methylation across diverse human cell lines and tissues.,"Varley, Katherine E; Gertz, Jason; Bowling, Kevin M; Parker, Stephanie L; Reddy, Timothy E; Pauli-Behn, Florencia; Cross, Marie K; Williams, Brian A; Stamatoyannopoulos, John A; Crawford, Gregory E; Absher, Devin M; Wold, Barbara J; Myers, Richard M",Genome Res.,TRUE
23327571,9,8.12,6.13,6.39,1.32,60.5,2013,"Systems pharmacology meets predictive, preventive, personalized and participatory medicine.","Jenkins, Sherry L; Ma'ayan, Avi",Pharmacogenomics,FALSE
23275885,4,1.90,6.69,8.86,0.28,14.6,2012,Genetic control of vulval development in Caenorhabditis briggsae.,"Sharanya, Devika; Thillainathan, Bavithra; Marri, Sujatha; Bojanala, Nagagireesh; Taylor, Jon; Flibotte, Stephane; Moerman, Donald G; Waterston, Robert H; Gupta, Bhagwati P",G3 (Bethesda),TRUE
23281792,0,0.00,2.70,2.90,0.00,2,2012,TIGER: tiled iterative genome assembler.,"Wu, Xiao-Long; Heo, Yun; El Hajj, Izzat; Hwu, Wen-Mei; Chen, Deming; Ma, Jian",BMC Bioinformatics,TRUE
23289680,0,0.00,1.39,0.93,0.00,2,2012,What is unique about nanomedicine? The significance of the mesoscale.,"Khushf, George; Siegel, Ronald A",J Law Med Ethics,TRUE
23289688,3,1.42,6.03,7.87,0.24,11.9,2012,Handling worker and third-party exposures to nanotherapeutics during clinical trials.,"Ramachandran, Gurumurthy; Howard, John; Maynard, Andrew; Philbert, Martin",J Law Med Ethics,TRUE
23353650,136,122.63,6.65,6.99,18.43,99.5,2013,A large-scale evaluation of computational protein function prediction.,"Radivojac, Predrag; Clark, Wyatt T; Oron, Tal Ronnen; Schnoes, Alexandra M; Wittkop, Tobias; Sokolov, Artem; Graim, Kiley; Funk, Christopher; Verspoor, Karin; Ben-Hur, Asa; Pandey, Gaurav; Yunes, Jeffrey M; Talwalkar, Ameet S; Repo, Susanna; Souza, Michael L; Piovesan, Damiano; Casadio, Rita; Wang, Zheng; Cheng, Jianlin; Fang, Hai; Gough, Julian; Koskinen, Patrik; Törönen, Petri; Nokso-Koivisto, Jussi; Holm, Liisa; Cozzetto, Domenico; Buchan, Daniel W A; Bryson, Kevin; Jones, David T; Limaye, Bhakti; Inamdar, Harshal; Datta, Avik; Manjari, Sunitha K; Joshi, Rajendra; Chitale, Meghana; Kihara, Daisuke; Lisewski, Andreas M; Erdin, Serkan; Venner, Eric; Lichtarge, Olivier; Rentzsch, Robert; Yang, Haixuan; Romero, Alfonso E; Bhat, Prajwal; Paccanaro, Alberto; Hamp, Tobias; Kaßner, Rebecca; Seemayer, Stefan; Vicedo, Esmeralda; Schaefer, Christian; Achten, Dominik; Auer, Florian; Boehm, Ariane; Braun, Tatjana; Hecht, Maximilian; Heron, Mark; Hönigschmid, Peter; Hopf, Thomas A; Kaufmann, Stefanie; Kiening, Michael; Krompass, Denis; Landerer, Cedric; Mahlich, Yannick; Roos, Manfred; Björne, Jari; Salakoski, Tapio; Wong, Andrew; Shatkay, Hagit; Gatzmann, Fanny; Sommer, Ingolf; Wass, Mark N; Sternberg, Michael J E; kunca, Nives; Supek, Fran; Bonjak, Matko; Panov, Pan?e; Deroski, Sao; muc, Tomislav; Kourmpetis, Yiannis A I; van Dijk, Aalt D J; ter Braak, Cajo J F; Zhou, Yuanpeng; Gong, Qingtian; Dong, Xinran; Tian, Weidong; Falda, Marco; Fontana, Paolo; Lavezzo, Enrico; Di Camillo, Barbara; Toppo, Stefano; Lan, Liang; Djuric, Nemanja; Guo, Yuhong; Vucetic, Slobodan; Bairoch, Amos; Linial, Michal; Babbitt, Patricia C; Brenner, Steven E; Orengo, Christine; Rost, Burkhard; Mooney, Sean D; Friedberg, Iddo",Nat. Methods,TRUE
23393156,26,23.44,6.60,6.93,3.55,88.7,2013,"Atp13a2-deficient mice exhibit neuronal ceroid lipofuscinosis, limited ?-synuclein accumulation and age-dependent sensorimotor deficits.","Schultheis, Patrick J; Fleming, Sheila M; Clippinger, Amy K; Lewis, Jada; Tsunemi, Taiji; Giasson, Benoit; Dickson, Dennis W; Mazzulli, Joseph R; Bardgett, Mark E; Haik, Kristi L; Ekhator, Osunde; Chava, Anil Kumar; Howard, John; Gannon, Matt; Hoffman, Elizabeth; Chen, Yinhuai; Prasad, Vikram; Linn, Stephen C; Tamargo, Rafael J; Westbroek, Wendy; Sidransky, Ellen; Krainc, Dimitri; Shull, Gary E",Hum. Mol. Genet.,TRUE
23408678,18,16.23,6.96,7.34,2.33,79.3,2013,Phenotypic variability of osteogenesis imperfecta type V caused by an IFITM5 mutation.,"Shapiro, Jay R; Lietman, Caressa; Grover, Monica; Lu, James T; Nagamani, Sandesh Cs; Dawson, Brian C; Baldridge, Dustin M; Bainbridge, Matthew N; Cohn, Dan H; Blazo, Maria; Roberts, Timothy T; Brennen, Feng-Shu; Wu, Yimei; Gibbs, Richard A; Melvin, Pamela; Campeau, Philippe M; Lee, Brendan H",J. Bone Miner. Res.,TRUE
23409037,7,6.31,4.04,3.96,1.56,66.6,2013,Simultaneous quantification of multiple bacteria by the BactoChip microarray designed to target species-specific marker genes.,"Ballarini, Annalisa; Segata, Nicola; Huttenhower, Curtis; Jousson, Olivier",PLoS ONE,TRUE
23411398,0,0.00,2.53,2.22,0.00,2,2013,Two-component covalent inhibitor.,"Cornett, Evan M; Gerasimova, Yulia V; Kolpashchikov, Dmitry M",Bioorg. Med. Chem.,TRUE
23430402,3,2.71,3.37,3.19,0.80,42,2013,Deaf genetic testing and psychological well-being in deaf adults.,"Palmer, Christina G S; Boudreault, Patrick; Baldwin, Erin E; Fox, Michelle; Deignan, Joshua L; Kobayashi, Yoko; Sininger, Yvonne; Grody, Wayne; Sinsheimer, Janet S",J Genet Couns,TRUE
23436801,26,23.44,8.55,9.19,2.74,83.4,2013,"Characterization of Torin2, an ATP-competitive inhibitor of mTOR, ATM, and ATR.","Liu, Qingsong; Xu, Chunxiao; Kirubakaran, Sivapriya; Zhang, Xin; Hur, Wooyoung; Liu, Yan; Kwiatkowski, Nicholas P; Wang, Jinhua; Westover, Kenneth D; Gao, Peng; Ercan, Dalia; Niepel, Mario; Thoreen, Carson C; Kang, Seong A; Patricelli, Matthew P; Wang, Yuchuan; Tupper, Tanya; Altabef, Abigail; Kawamura, Hidemasa; Held, Kathryn D; Chou, Danny M; Elledge, Stephen J; Janne, Pasi A; Wong, Kwok-Kin; Sabatini, David M; Gray, Nathanael S",Cancer Res.,TRUE
23335334,3,2.71,6.52,6.84,0.41,22.1,2013,Correcting coalescent analyses for panel-based SNP ascertainment.,"McGill, James R; Walkup, Elizabeth A; Kuhner, Mary K",Genetics,TRUE
23337890,55,49.59,5.12,5.22,9.68,98.1,2013,Propionibacterium acnes strain populations in the human skin microbiome associated with acne.,"Fitz-Gibbon, Sorel; Tomida, Shuta; Chiu, Bor-Han; Nguyen, Lin; Du, Christine; Liu, Minghsun; Elashoff, David; Erfe, Marie C; Loncaric, Anya; Kim, Jenny; Modlin, Robert L; Miller, Jeff F; Sodergren, Erica; Craft, Noah; Weinstock, George M; Li, Huiying",J. Invest. Dermatol.,TRUE
23557731,2,1.80,8.65,9.30,0.21,10.4,2013,Enhanced chemical stability of adomet analogues for improved methyltransferase-directed labeling of DNA.,"Lukinavi?ius, Gravydas; Tomkuvien?, Migl?; Masevi?ius, Viktoras; Klimaauskas, Saulius",ACS Chem. Biol.,TRUE
23558254,13,11.72,6.39,6.68,1.83,72,2013,Description and pilot results from a novel method for evaluating return of incidental findings from next-generation sequencing technologies.,"Goddard, Katrina A B; Whitlock, Evelyn P; Berg, Jonathan S; Williams, Marc S; Webber, Elizabeth M; Webster, Jennifer A; Lin, Jennifer S; Schrader, Kasmintan A; Campos-Outcalt, Doug; Offit, Kenneth; Feigelson, Heather Spencer; Hollombe, Celine",Genet. Med.,TRUE
23559530,34,30.66,5.44,5.59,5.63,94.8,2013,Impact of direct-to-consumer genomic testing at long term follow-up.,"Bloss, Cinnamon S; Wineinger, Nathan E; Darst, Burcu F; Schork, Nicholas J; Topol, Eric J",J. Med. Genet.,TRUE
23443460,76,68.53,9.00,9.71,7.61,97,2013,Clonal diversity of recurrently mutated genes in myelodysplastic syndromes.,"Walter, M J; Shen, D; Shao, J; Ding, L; White, B S; Kandoth, C; Miller, C A; Niu, B; McLellan, M D; Dees, N D; Fulton, R; Elliot, K; Heath, S; Grillot, M; Westervelt, P; Link, D C; DiPersio, J F; Mardis, E; Ley, T J; Wilson, R K; Graubert, T A",Leukemia,TRUE
23527308,9,8.12,3.84,3.74,2.11,76.4,2013,Soluble guanylate cyclase ?1-deficient mice: a novel murine model for primary open angle glaucoma.,"Buys, Emmanuel S; Ko, Yu-Chieh; Alt, Clemens; Hayton, Sarah R; Jones, Alexander; Tainsh, Laurel T; Ren, Ruiyi; Giani, Andrea; Clerté, Maeva; Abernathy, Emma; Tainsh, Robert E T; Oh, Dong-Jin; Malhotra, Rajeev; Arora, Pankaj; de Waard, Nadine; Yu, Binglan; Turcotte, Raphael; Nathan, Daniel; Scherrer-Crosbie, Marielle; Loomis, Stephanie J; Kang, Jae H; Lin, Charles P; Gong, Haiyan; Rhee, Douglas J; Brouckaert, Peter; Wiggs, Janey L; Gregory, Meredith S; Pasquale, Louis R; Bloch, Kenneth D; Ksander, Bruce R",PLoS ONE,TRUE
23535823,19,17.13,8.14,8.70,2.11,76.3,2013,A sequence variant associated with sortilin-1 (SORT1) on 1p13.3 is independently associated with abdominal aortic aneurysm.,"Jones, Gregory T; Bown, Matthew J; Gretarsdottir, Solveig; Romaine, Simon P R; Helgadottir, Anna; Yu, Grace; Tromp, Gerard; Norman, Paul E; Jin, Cao; Baas, Annette F; Blankensteijn, Jan D; Kullo, Iftikhar J; Phillips, L Victoria; Williams, Michael J A; Topless, Ruth; Merriman, Tony R; Vasudevan, Thodor M; Lewis, David R; Blair, Ross D; Hill, Andrew A; Sayers, Robert D; Powell, Janet T; Deloukas, Panagiotis; Thorleifsson, Gudmar; Matthiasson, Stefan E; Thorsteinsdottir, Unnur; Golledge, Jonathan; Ariëns, Robert A; Johnson, Anne; Sohrabi, Soroush; Scott, D Julian; Carey, David J; Erdman, Robert; Elmore, James R; Kuivaniemi, Helena; Samani, Nilesh J; Stefansson, Kari; van Rij, Andre M",Hum. Mol. Genet.,TRUE
23493048,4,3.61,7.35,7.79,0.49,26.4,2013,Natriuretic peptide receptor-3 gene (NPR3): nonsynonymous polymorphism results in significant reduction in protein expression because of accelerated degradation.,"Pereira, Naveen L; Lin, Dong; Pelleymounter, Linda; Moon, Irene; Stilling, Gail; Eckloff, Bruce W; Wieben, Eric D; Redfield, Margaret M; Burnett, John C; Yee, Vivien C; Weinshilboum, Richard M",Circ Cardiovasc Genet,TRUE
23508249,8,7.21,6.56,6.89,1.10,53.6,2013,Replication of genetic loci for ages at menarche and menopause in the multi-ethnic Population Architecture using Genomics and Epidemiology (PAGE) study.,"Carty, C L; Spencer, K L; Setiawan, V W; Fernandez-Rhodes, L; Malinowski, J; Buyske, S; Young, A; Jorgensen, N W; Cheng, I; Carlson, C S; Brown-Gentry, K; Goodloe, R; Park, A; Parikh, N I; Henderson, B; Le Marchand, L; Wactawski-Wende, J; Fornage, M; Matise, T C; Hindorff, L A; Arnold, A M; Haiman, C A; Franceschini, N; Peters, U; Crawford, D C",Hum. Reprod.,TRUE
