20540517,47,11.44,3.92,5.10,2.92,84.8,2010,Complementarity between a docking and a high-throughput screen in discovering new cruzain inhibitors.,"Ferreira, Rafaela S; Simeonov, Anton; Jadhav, Ajit; Eidam, Oliv; Mott, Bryan T; Keiser, Michael J; McKerrow, James H; Maloney, David J; Irwin, John J; Shoichet, Brian K",J. Med. Chem.,TRUE
20543846,54,13.14,6.77,10.82,1.94,73.8,2010,Linking promoters to functional transcripts in small samples with nanoCAGE and CAGEscan.,"Plessy, Charles; Bertin, Nicolas; Takahashi, Hazuki; Simone, Roberto; Salimullah, Md; Lassmann, Timo; Vitezic, Morana; Severin, Jessica; Olivarius, Signe; Lazarevic, Dejan; Hornig, Nadine; Orlando, Valerio; Bell, Ian; Gao, Hui; Dumais, Jacqueline; Kapranov, Philipp; Wang, Huaien; Davis, Carrie A; Gingeras, Thomas R; Kawai, Jun; Daub, Carsten O; Hayashizaki, Yoshihide; Gustincich, Stefano; Carninci, Piero",Nat. Methods,TRUE
20547776,27,6.57,4.31,5.88,1.53,65.7,2010,The teleost anatomy ontology: anatomical representation for the genomics age.,"Dahdul, Wasila M; Lundberg, John G; Midford, Peter E; Balhoff, James P; Lapp, Hilmar; Vision, Todd J; Haendel, Melissa A; Westerfield, Monte; Mabee, Paula M",Syst. Biol.,TRUE
20555324,139,33.83,6.54,10.36,5.17,94,2010,Members of the H3K4 trimethylation complex regulate lifespan in a germline-dependent manner in C. elegans.,"Greer, Eric L; Maures, Travis J; Hauswirth, Anna G; Green, Erin M; Leeman, Dena S; Maro, Géraldine S; Han, Shuo; Banko, Max R; Gozani, Or; Brunet, Anne",Nature,TRUE
20564318,15,3.65,4.71,6.69,0.77,40.7,2010,Contribution of HPC1 (RNASEL) and HPCX variants to prostate cancer in a founder population.,"Agalliu, Ilir; Leanza, Suzanne M; Smith, Lorie; Trent, Jeffrey M; Carpten, John D; Bailey-Wilson, Joan E; Burk, Robert D",Prostate,TRUE
20567762,24,5.84,5.33,7.93,1.10,53.5,2010,A chemiluminescence-based method for identification of histone lysine methyltransferase inhibitors.,"Quinn, Amy M; Allali-Hassani, Abdellah; Vedadi, Masoud; Simeonov, Anton",Mol Biosyst,TRUE
20576142,26,6.33,4.69,6.64,1.35,61.3,2010,Light whole genome sequence for SNP discovery across domestic cat breeds.,"Mullikin, James C; Hansen, Nancy F; Shen, Lei; Ebling, Heather; Donahue, William F; Tao, Wei; Saranga, David J; Brand, Adrianne; Rubenfield, Marc J; Young, Alice C; Cruz, Pedro; ; Driscoll, Carlos; David, Victor; Al-Murrani, Samer W K; Locniskar, Mary F; Abrahamsen, Mitchell S; O'Brien, Stephen J; Smith, Douglas R; Brockman, Jeffrey A",BMC Genomics,TRUE
20586087,13,3.16,4.89,7.03,0.65,34.6,2010,Artificial genetic systems: self-avoiding DNA in PCR and multiplexed PCR.,"Hoshika, Shuichi; Chen, Fei; Leal, Nicole A; Benner, Steven A",Angew. Chem. Int. Ed. Engl.,TRUE
20623772,27,6.57,3.38,4.01,1.94,73.9,2010,Challenges assessing clinical endpoints in early Huntington disease.,"Paulsen, Jane S; Wang, Chiachi; Duff, Kevin; Barker, Roger; Nance, Martha; Beglinger, Leigh; Moser, David; Williams, Janet K; Simpson, Sheila; Langbehn, Douglas; van Kammen, Daniel P;",Mov. Disord.,TRUE
20672375,28,6.81,5.45,8.18,1.25,58.4,2010,Molecular analysis expands the spectrum of phenotypes associated with GLI3 mutations.,"Johnston, Jennifer J; Sapp, Julie C; Turner, Joyce T; Amor, David; Aftimos, Salim; Aleck, Kyrieckos A; Bocian, Maureen; Bodurtha, Joann N; Cox, Gerald F; Curry, Cynthia J; Day, Ruth; Donnai, Dian; Field, Michael; Fujiwara, Ikuma; Gabbett, Michael; Gal, Moran; Graham, John M; Hedera, Peter; Hennekam, Raoul C M; Hersh, Joseph H; Hopkin, Robert J; Kayserili, Hülya; Kidd, Alexa M J; Kimonis, Virginia; Lin, Angela E; Lynch, Sally Ann; Maisenbacher, Melissa; Mansour, Sahar; McGaughran, Julie; Mehta, Lakshmi; Murphy, Helen; Raygada, Margarita; Robin, Nathaniel H; Rope, Alan F; Rosenbaum, Kenneth N; Schaefer, G Bradley; Shealy, Amy; Smith, Wendy; Soller, Maria; Sommer, Annmarie; Stalker, Heather J; Steiner, Bernhard; Stephan, Mark J; Tilstra, David; Tomkins, Susan; Trapane, Pamela; Tsai, Anne Chun-Hui; Van Allen, Margot I; Vasudevan, Pradeep C; Zabel, Bernhard; Zunich, Janice; Black, Graeme C M; Biesecker, Leslie G",Hum. Mutat.,TRUE
20684766,20,4.87,5.20,7.66,0.94,47.6,2010,Genome mapping and characterization of the Anopheles gambiae heterochromatin.,"Sharakhova, Maria V; George, Phillip; Brusentsova, Irina V; Leman, Scotland C; Bailey, Jeffrey A; Smith, Christopher D; Sharakhov, Igor V",BMC Genomics,TRUE
20687689,36,8.76,3.99,5.23,2.20,77.6,2010,Polymer translocation through alpha-hemolysin pore with tunable polymer-pore electrostatic interaction.,"Wong, Chiu Tai Andrew; Muthukumar, M",J Chem Phys,TRUE
20711195,232,56.46,5.78,8.82,9.78,98.1,2010,Comprehensive comparative analysis of strand-specific RNA sequencing methods.,"Levin, Joshua Z; Yassour, Moran; Adiconis, Xian; Nusbaum, Chad; Thompson, Dawn Anne; Friedman, Nir; Gnirke, Andreas; Regev, Aviv",Nat. Methods,TRUE
20711490,113,27.50,4.93,7.12,5.58,94.7,2010,A simple genetic architecture underlies morphological variation in dogs.,"Boyko, Adam R; Quignon, Pascale; Li, Lin; Schoenebeck, Jeffrey J; Degenhardt, Jeremiah D; Lohmueller, Kirk E; Zhao, Keyan; Brisbin, Abra; Parker, Heidi G; vonHoldt, Bridgett M; Cargill, Michele; Auton, Adam; Reynolds, Andy; Elkahloun, Abdel G; Castelhano, Marta; Mosher, Dana S; Sutter, Nathan B; Johnson, Gary S; Novembre, John; Hubisz, Melissa J; Siepel, Adam; Wayne, Robert K; Bustamante, Carlos D; Ostrander, Elaine A",PLoS Biol.,TRUE
20714050,12,2.92,3.86,4.99,0.76,39.8,2010,Nanopore formation by low-energy focused electron beam machining.,"Spinney, P S; Howitt, D G; Smith, R L; Collins, S D",Nanotechnology,TRUE
20732903,35,8.52,3.78,4.83,2.25,78.3,2010,Predicting sensation seeking from dopamine genes. A candidate-system approach.,"Derringer, Jaime; Krueger, Robert F; Dick, Danielle M; Saccone, Scott; Grucza, Richard A; Agrawal, Arpana; Lin, Peng; Almasy, Laura; Edenberg, Howard J; Foroud, Tatiana; Nurnberger, John I; Hesselbrock, Victor M; Kramer, John R; Kuperman, Samuel; Porjesz, Bernice; Schuckit, Marc A; Bierut, Laura J;",Psychol Sci,TRUE
20733223,8,2.57,2.89,2.84,0.89,45.7,2011,"Canonical correlation analysis for multilabel classification: a least-squares formulation, extensions, and analysis.","Sun, Liang; Ji, Shuiwang; Ye, Jieping",IEEE Trans Pattern Anal Mach Intell,TRUE
20810466,20,4.87,3.98,5.22,1.22,57.6,2010,"Maternal alcohol consumption, alcohol metabolism genes, and the risk of oral clefts: a population-based case-control study in Norway, 1996-2001.","Boyles, Abee L; DeRoo, Lisa A; Lie, Rolv T; Taylor, Jack A; Jugessur, Astanand; Murray, Jeffrey C; Wilcox, Allen J",Am. J. Epidemiol.,TRUE
20818378,69,16.79,4.27,5.81,3.93,90.4,2010,Microbial community resemblance methods differ in their ability to detect biologically relevant patterns.,"Kuczynski, Justin; Liu, Zongzhi; Lozupone, Catherine; McDonald, Daniel; Fierer, Noah; Knight, Rob",Nat. Methods,TRUE
20839314,8,2.57,5.10,6.90,0.50,27.1,2011,A transcriptional network signature characterizes lung cancer subtypes.,"Chang, Hsun-Hsien; Dreyfuss, Jonathan M; Ramoni, Marco F",Cancer,TRUE
20840187,22,5.35,4.24,5.74,1.26,58.8,2010,Peer smoking and the nicotinic receptor genes: an examination of genetic and environmental risks for nicotine dependence.,"Johnson, Eric O; Chen, Li-Shiun; Breslau, Naomi; Hatsukami, Dorothy; Robbins, Tania; Saccone, Nancy L; Grucza, Richard A; Bierut, Laura J",Addiction,TRUE
20871614,58,14.12,5.67,8.60,2.49,81.1,2010,Replication of individual DNA molecules under electronic control using a protein nanopore.,"Olasagasti, Felix; Lieberman, Kate R; Benner, Seico; Cherf, Gerald M; Dahl, Joseph M; Deamer, David W; Akeson, Mark",Nat Nanotechnol,TRUE
20884846,98,23.85,4.66,6.59,5.11,93.9,2010,Multiple genetic loci influence serum urate levels and their relationship with gout and cardiovascular disease risk factors.,"Yang, Qiong; Köttgen, Anna; Dehghan, Abbas; Smith, Albert V; Glazer, Nicole L; Chen, Ming-Huei; Chasman, Daniel I; Aspelund, Thor; Eiriksdottir, Gudny; Harris, Tamara B; Launer, Lenore; Nalls, Michael; Hernandez, Dena; Arking, Dan E; Boerwinkle, Eric; Grove, Megan L; Li, Man; Linda Kao, W H; Chonchol, Michel; Haritunians, Talin; Li, Guo; Lumley, Thomas; Psaty, Bruce M; Shlipak, Michael; Hwang, Shih-Jen; Larson, Martin G; O'Donnell, Christopher J; Upadhyay, Ashish; van Duijn, Cornelia M; Hofman, Albert; Rivadeneira, Fernando; Stricker, Bruno; Uitterlinden, Andre G; Paré, Guillaume; Parker, Alex N; Ridker, Paul M; Siscovick, David S; Gudnason, Vilmundur; Witteman, Jacqueline C; Fox, Caroline S; Coresh, Josef",Circ Cardiovasc Genet,TRUE
20889494,28,6.81,6.29,9.85,1.08,53.1,2010,Interrogating local population structure for fine mapping in genome-wide association studies.,"Qin, Huaizhen; Morris, Nathan; Kang, Sun J; Li, Mingyao; Tayo, Bamidele; Lyon, Helen; Hirschhorn, Joel; Cooper, Richard S; Zhu, Xiaofeng",Bioinformatics,TRUE
20920349,31,7.54,5.80,8.87,1.30,59.9,2010,"Genomic insights into Wnt signaling in an early diverging metazoan, the ctenophore Mnemiopsis leidyi.","Pang, Kevin; Ryan, Joseph F; ; Mullikin, James C; Baxevanis, Andreas D; Martindale, Mark Q",Evodevo,TRUE
20927439,65,15.82,5.98,9.23,2.65,82.6,2010,Identification of epigenetic DNA modifications with a protein nanopore.,"Wallace, Emma V B; Stoddart, David; Heron, Andrew J; Mikhailova, Ellina; Maglia, Giovanni; Donohoe, Timothy J; Bayley, Hagan",Chem. Commun. (Camb.),TRUE
20953189,125,30.42,5.46,8.18,5.58,94.7,2010,Genome-wide association analysis identifies three psoriasis susceptibility loci.,"Stuart, Philip E; Nair, Rajan P; Ellinghaus, Eva; Ding, Jun; Tejasvi, Trilokraj; Gudjonsson, Johann E; Li, Yun; Weidinger, Stephan; Eberlein, Bernadette; Gieger, Christian; Wichmann, H Erich; Kunz, Manfred; Ike, Robert; Krueger, Gerald G; Bowcock, Anne M; Mrowietz, Ulrich; Lim, Henry W; Voorhees, John J; Abecasis, Gonçalo R; Weichenthal, Michael; Franke, Andre; Rahman, Proton; Gladman, Dafna D; Elder, James T",Nat. Genet.,TRUE
21044360,3,0.73,4.98,7.22,0.15,7.1,2010,Mapping transcription mechanisms from multimodal genomic data.,"Chang, Hsun-Hsien; McGeachie, Michael; Alterovitz, Gil; Ramoni, Marco F",BMC Bioinformatics,TRUE
21049082,94,22.88,5.67,8.61,4.04,90.8,2010,Quiescent fibroblasts exhibit high metabolic activity.,"Lemons, Johanna M S; Feng, Xiao-Jiang; Bennett, Bryson D; Legesse-Miller, Aster; Johnson, Elizabeth L; Raitman, Irene; Pollina, Elizabeth A; Rabitz, Herschel A; Rabinowitz, Joshua D; Coller, Hilary A",PLoS Biol.,TRUE
21071413,430,138.31,5.69,7.98,24.30,99.7,2011,The BioGRID Interaction Database: 2011 update.,"Stark, Chris; Breitkreutz, Bobby-Joe; Chatr-Aryamontri, Andrew; Boucher, Lorrie; Oughtred, Rose; Livstone, Michael S; Nixon, Julie; Van Auken, Kimberly; Wang, Xiaodong; Shi, Xiaoqi; Reguly, Teresa; Rust, Jennifer M; Winter, Andrew; Dolinski, Kara; Tyers, Mike",Nucleic Acids Res.,TRUE
21071415,2,0.64,4.90,6.54,0.13,6.4,2011,Genome-wide detection of a TFIID localization element from an initial human disease mutation.,"Yang, Mary Q; Laflamme, Karina; Gotea, Valer; Joiner, Clinton H; Seidel, Nancy E; Wong, Clara; Petrykowska, Hanna M; Lichtenberg, Jens; Lee, Stephen; Welch, Lonnie; Gallagher, Patrick G; Bodine, David M; Elnitski, Laura",Nucleic Acids Res.,TRUE
21071419,42,13.51,5.57,7.75,2.43,80.4,2011,Digital MDA for enumeration of total nucleic acid contamination.,"Blainey, Paul C; Quake, Stephen R",Nucleic Acids Res.,TRUE
21076119,4,1.29,4.99,6.70,0.26,13.1,2011,Unsupported planar lipid membranes formed from mycolic acids of Mycobacterium tuberculosis.,"Langford, Kyle W; Penkov, Boyan; Derrington, Ian M; Gundlach, Jens H",J. Lipid Res.,TRUE
21082069,10,2.43,4.58,6.42,0.53,28.6,2010,Antarctic notothenioid fishes: genomic resources and strategies for analyzing an adaptive radiation.,"Detrich, H W; Amemiya, Chris T",Integr. Comp. Biol.,TRUE
21084522,9,2.89,4.38,5.58,0.66,35.3,2011,Development and characterization of a highly specific and sensitive SYBR green reverse transcriptase PCR assay for detection of the 2009 pandemic H1N1 influenza virus on the basis of sequence signatures.,"Medina, Rafael A; Rojas, Mark; Tuin, Astrid; Huff, Stephen; Ferres, Marcela; Martinez-Valdebenito, Constanza; Godoy, Paula; García-Sastre, Adolfo; Fofanov, Yuriy; SantaLucia, John",J. Clin. Microbiol.,TRUE
21085593,213,51.84,5.45,8.17,9.51,98,2010,Enrichment map: a network-based method for gene-set enrichment visualization and interpretation.,"Merico, Daniele; Isserlin, Ruth; Stueker, Oliver; Emili, Andrew; Bader, Gary D",PLoS ONE,TRUE
21114270,15,3.65,4.36,5.97,0.84,43.5,2010,Alkylating tryptic peptides to enhance electrospray ionization mass spectrometry analysis.,"Kulevich, Suzanne E; Frey, Brian L; Kreitinger, Gloria; Smith, Lloyd M",Anal. Chem.,TRUE
20980404,20,4.87,5.77,8.80,0.84,43.8,2010,Role of canonical Wnt signaling/ß-catenin via Dermo1 in cranial dermal cell development.,"Tran, Thu H; Jarrell, Andrew; Zentner, Gabriel E; Welsh, Adrienne; Brownell, Isaac; Scacheri, Peter C; Atit, Radhika",Development,TRUE
21169219,43,13.83,6.00,8.56,2.30,78.9,2011,Completely phased genome sequencing through chromosome sorting.,"Yang, Hong; Chen, Xi; Wong, Wing Hung",Proc. Natl. Acad. Sci. U.S.A.,TRUE
21169336,3,0.96,6.24,8.99,0.15,7.5,2011,High-throughput mapping of protein occupancy identifies functional elements without the restriction of a candidate factor approach.,"Ferraris, L; Stewart, A P; Gemberling, M P; Reid, D C; Lapadula, M J; Thompson, W A; Fairbrother, W G",Nucleic Acids Res.,TRUE
21172047,4,0.97,6.34,9.96,0.15,7.5,2010,Detection and reconstruction of tandemly organized de novo copy number variations.,"He, Dan; Furlotte, Nicholas; Eskin, Eleazar",BMC Bioinformatics,TRUE
21177961,73,23.48,7.04,10.46,3.33,87.6,2011,Genome-wide analysis of promoter architecture in Drosophila melanogaster.,"Hoskins, Roger A; Landolin, Jane M; Brown, James B; Sandler, Jeremy E; Takahashi, Hazuki; Lassmann, Timo; Yu, Charles; Booth, Benjamin W; Zhang, Dayu; Wan, Kenneth H; Yang, Li; Boley, Nathan; Andrews, Justen; Kaufman, Thomas C; Graveley, Brenton R; Bickel, Peter J; Carninci, Piero; Carlson, Joseph W; Celniker, Susan E",Genome Res.,TRUE
21181899,15,4.82,6.02,8.58,0.80,41.9,2011,Ancestry informative marker panels for African Americans based on subsets of commercially available SNP arrays.,"Tandon, Arti; Patterson, Nick; Reich, David",Genet. Epidemiol.,TRUE
21183079,408,99.29,5.64,8.56,17.60,99.4,2010,A tissue-specific atlas of mouse protein phosphorylation and expression.,"Huttlin, Edward L; Jedrychowski, Mark P; Elias, Joshua E; Goswami, Tapasree; Rad, Ramin; Beausoleil, Sean A; Villén, Judit; Haas, Wilhelm; Sowa, Mathew E; Gygi, Steven P",Cell,TRUE
21193724,0,0.00,2.12,1.43,0.00,2,2011,A continuous-index Bayesian hidden Markov model for prediction of nucleosome positioning in genomic DNA.,"Mitra, Ritendranath; Gupta, Mayetri",Biostatistics,TRUE
21195649,4,1.29,3.83,4.57,0.34,17.6,2011,Elevated concentrations of sedoheptulose in bloodspots of patients with cystinosis caused by the 57-kb deletion: implications for diagnostics and neonatal screening.,"Wamelink, M M C; Struys, E A; Jansen, E E W; Blom, H J; Vilboux, T; Gahl, W A; Kömhoff, M; Jakobs, C; Levtchenko, E N",Mol. Genet. Metab.,TRUE
21209828,6,1.46,4.23,5.72,0.35,18.2,2010,A common CNR1 (cannabinoid receptor 1) haplotype attenuates the decrease in HDL cholesterol that typically accompanies weight gain.,"Feng, Qiping; Jiang, Lan; Berg, Richard L; Antonik, Melissa; MacKinney, Erin; Gunnell-Santoro, Jennifer; McCarty, Catherine A; Wilke, Russell A",PLoS ONE,TRUE
21220591,18,5.79,5.01,6.73,1.16,55.5,2011,Human papillomaviruses as therapeutic targets in human cancer.,"Hellner, Karin; Münger, Karl",J. Clin. Oncol.,TRUE
21223608,4,1.29,4.58,5.94,0.28,14.5,2011,Ethical and legal issues in enhancement research on human subjects.,"Mehlman, Maxwell J; Berg, Jessica W; Juengst, Eric T; Kodish, Eric",Camb Q Healthc Ethics,TRUE
21241896,243,78.16,7.26,10.86,10.77,98.5,2011,Densely interconnected transcriptional circuits control cell states in human hematopoiesis.,"Novershtern, Noa; Subramanian, Aravind; Lawton, Lee N; Mak, Raymond H; Haining, W Nicholas; McConkey, Marie E; Habib, Naomi; Yosef, Nir; Chang, Cindy Y; Shay, Tal; Frampton, Garrett M; Drake, Adam C B; Leskov, Ilya; Nilsson, Bjorn; Preffer, Fred; Dombkowski, David; Evans, John W; Liefeld, Ted; Smutko, John S; Chen, Jianzhu; Friedman, Nir; Young, Richard A; Golub, Todd R; Regev, Aviv; Ebert, Benjamin L",Cell,TRUE
21266523,35,11.26,4.47,5.74,2.52,81.4,2011,Expression of SLCO transport genes in castration-resistant prostate cancer and impact of genetic variation in SLCO1B3 and SLCO2B1 on prostate cancer outcomes.,"Wright, Jonathan L; Kwon, Erika M; Ostrander, Elaine A; Montgomery, R Bruce; Lin, Daniel W; Vessella, Robert; Stanford, Janet L; Mostaghel, Elahe A",Cancer Epidemiol. Biomarkers Prev.,TRUE
21266578,13,4.18,5.73,8.05,0.73,38.6,2011,Loss of subcellular lipid transport due to ARV1 deficiency disrupts organelle homeostasis and activates the unfolded protein response.,"Shechtman, Caryn F; Henneberry, Annette L; Seimon, Tracie A; Tinkelenberg, Arthur H; Wilcox, Lisa J; Lee, Eunjee; Fazlollahi, Mina; Munkacsi, Andrew B; Bussemaker, Harmen J; Tabas, Ira; Sturley, Stephen L",J. Biol. Chem.,TRUE
21269473,176,56.61,5.37,7.39,10.54,98.4,2011,The eMERGE Network: a consortium of biorepositories linked to electronic medical records data for conducting genomic studies.,"McCarty, Catherine A; Chisholm, Rex L; Chute, Christopher G; Kullo, Iftikhar J; Jarvik, Gail P; Larson, Eric B; Li, Rongling; Masys, Daniel R; Ritchie, Marylyn D; Roden, Dan M; Struewing, Jeffery P; Wolf, Wendy A;",BMC Med Genomics,TRUE
21282631,91,29.27,5.12,6.94,5.71,94.9,2011,Draft genome of the globally widespread and invasive Argentine ant (Linepithema humile).,"Smith, Christopher D; Zimin, Aleksey; Holt, Carson; Abouheif, Ehab; Benton, Richard; Cash, Elizabeth; Croset, Vincent; Currie, Cameron R; Elhaik, Eran; Elsik, Christine G; Fave, Marie-Julie; Fernandes, Vilaiwan; Gadau, Jürgen; Gibson, Joshua D; Graur, Dan; Grubbs, Kirk J; Hagen, Darren E; Helmkampf, Martin; Holley, Jo-Anne; Hu, Hao; Viniegra, Ana Sofia Ibarraran; Johnson, Brian R; Johnson, Reed M; Khila, Abderrahman; Kim, Jay W; Laird, Joseph; Mathis, Kaitlyn A; Moeller, Joseph A; Muñoz-Torres, Monica C; Murphy, Marguerite C; Nakamura, Rin; Nigam, Surabhi; Overson, Rick P; Placek, Jennifer E; Rajakumar, Rajendhran; Reese, Justin T; Robertson, Hugh M; Smith, Chris R; Suarez, Andrew V; Suen, Garret; Suhr, Elissa L; Tao, Shu; Torres, Candice W; van Wilgenburg, Ellen; Viljakainen, Lumi; Walden, Kimberly K O; Wild, Alexander L; Yandell, Mark; Yorke, James A; Tsutsui, Neil D",Proc. Natl. Acad. Sci. U.S.A.,TRUE
21282651,90,28.95,5.25,7.17,5.52,94.6,2011,Draft genome of the red harvester ant Pogonomyrmex barbatus.,"Smith, Chris R; Smith, Christopher D; Robertson, Hugh M; Helmkampf, Martin; Zimin, Aleksey; Yandell, Mark; Holt, Carson; Hu, Hao; Abouheif, Ehab; Benton, Richard; Cash, Elizabeth; Croset, Vincent; Currie, Cameron R; Elhaik, Eran; Elsik, Christine G; Favé, Marie-Julie; Fernandes, Vilaiwan; Gibson, Joshua D; Graur, Dan; Gronenberg, Wulfila; Grubbs, Kirk J; Hagen, Darren E; Viniegra, Ana Sofia Ibarraran; Johnson, Brian R; Johnson, Reed M; Khila, Abderrahman; Kim, Jay W; Mathis, Kaitlyn A; Munoz-Torres, Monica C; Murphy, Marguerite C; Mustard, Julie A; Nakamura, Rin; Niehuis, Oliver; Nigam, Surabhi; Overson, Rick P; Placek, Jennifer E; Rajakumar, Rajendhran; Reese, Justin T; Suen, Garret; Tao, Shu; Torres, Candice W; Tsutsui, Neil D; Viljakainen, Lumi; Wolschin, Florian; Gadau, Jürgen",Proc. Natl. Acad. Sci. U.S.A.,TRUE
21300846,11,3.54,6.08,8.69,0.58,31.3,2011,Maximally efficient modeling of DNA sequence motifs at all levels of complexity.,"Stormo, Gary D",Genetics,TRUE
21288002,34,10.94,6.24,8.99,1.75,70.5,2011,Structure and mechanisms of lysine methylation recognition by the chromodomain in gene transcription.,"Yap, Kyoko L; Zhou, Ming-Ming",Biochemistry,FALSE
21289614,5,1.61,5.49,7.61,0.29,15.1,2011,Autoinflammation in 2010: expanding clinical spectrum and broadening therapeutic horizons.,"Ombrello, Michael J; Kastner, Daniel L",Nat Rev Rheumatol,FALSE
21296867,47,15.12,5.12,6.93,2.95,85.1,2011,Maternal methyl-donor supplementation induces prolonged murine offspring colitis susceptibility in association with mucosal epigenetic and microbiomic changes.,"Schaible, Tiffany D; Harris, R Alan; Dowd, Scot E; Smith, C Wayne; Kellermayer, Richard",Hum. Mol. Genet.,TRUE
21304936,12,3.86,5.37,7.39,0.72,38.1,2011,Accurate quantification of functional analogy among close homologs.,"Chikina, Maria D; Troyanskaya, Olga G",PLoS Comput. Biol.,TRUE
21308977,9,2.89,4.32,5.46,0.67,35.8,2011,VACTERL association and mitochondrial dysfunction.,"Solomon, Benjamin D; Patel, Ankita; Cheung, Sau Wai; Pineda-Alvarez, Daniel E",Birth Defects Res. Part A Clin. Mol. Teratol.,TRUE
21311340,37,11.90,5.82,8.23,2.04,75.4,2011,Downsizing genomic medicine: approaching the ethical complexity of whole-genome sequencing by starting small.,"Sharp, Richard R",Genet. Med.,TRUE
21331044,97,31.20,6.00,8.56,5.20,94,2011,Lifespan extension induced by AMPK and calcineurin is mediated by CRTC-1 and CREB.,"Mair, William; Morantte, Ianessa; Rodrigues, Ana P C; Manning, Gerard; Montminy, Marc; Shaw, Reuben J; Dillin, Andrew",Nature,TRUE
21333602,19,6.11,4.73,6.23,1.29,59.6,2011,Effective sample size: Quick estimation of the effect of related samples in genetic case-control association analyses.,"Yang, Yaning; Remmers, Elaine F; Ogunwole, Chukwuma B; Kastner, Daniel L; Gregersen, Peter K; Li, Wentian",Comput Biol Chem,TRUE
21364937,132,42.46,4.76,6.27,8.92,97.8,2011,Genome of a low-salinity ammonia-oxidizing archaeon determined by single-cell and metagenomic analysis.,"Blainey, Paul C; Mosier, Annika C; Potanina, Anastasia; Francis, Christopher A; Quake, Stephen R",PLoS ONE,TRUE
21383966,55,17.69,7.52,11.34,2.35,79.5,2011,Single-tissue and cross-tissue heritability of gene expression via identity-by-descent in related or unrelated individuals.,"Price, Alkes L; Helgason, Agnar; Thorleifsson, Gudmar; McCarroll, Steven A; Kong, Augustine; Stefansson, Kari",PLoS Genet.,TRUE
21419664,125,40.21,6.74,9.90,5.97,95.3,2011,Essential role for retinoic acid in the promotion of CD4(+) T cell effector responses via retinoic acid receptor alpha.,"Hall, Jason A; Cannons, Jennifer L; Grainger, John R; Dos Santos, Liliane M; Hand, Timothy W; Naik, Shruti; Wohlfert, Elizabeth A; Chou, David B; Oldenhove, Guillaume; Robinson, Melody; Grigg, Michael E; Kastenmayer, Robin; Schwartzberg, Pamela L; Belkaid, Yasmine",Immunity,TRUE
21454968,23,7.40,5.57,7.76,1.33,60.7,2011,Genomewide linkage scan for diabetic renal failure and albuminuria: the FIND study.,"Igo, Robert P; Iyengar, Sudha K; Nicholas, Susanne B; Goddard, Katrina A B; Langefeld, Carl D; Hanson, Robert L; Duggirala, Ravindranath; Divers, Jasmin; Abboud, Hanna; Adler, Sharon G; Arar, Nedal H; Horvath, Amanda; Elston, Robert C; Bowden, Donald W; Guo, Xiuqing; Ipp, Eli; Kao, W H Linda; Kimmel, Paul L; Knowler, William C; Meoni, Lucy A; Molineros, Julio; Nelson, Robert G; Pahl, Madeline V; Parekh, Rulan S; Rasooly, Rebekah S; Schelling, Jeffrey R; Shah, Vallabh O; Smith, Michael W; Winkler, Cheryl A; Zager, Philip G; Sedor, John R; Freedman, Barry I;",Am. J. Nephrol.,TRUE
21478295,67,21.55,5.94,8.43,3.63,89.1,2011,PIK3R1 (p85?) is somatically mutated at high frequency in primary endometrial cancer.,"Urick, Mary E; Rudd, Meghan L; Godwin, Andrew K; Sgroi, Dennis; Merino, Maria; Bell, Daphne W",Cancer Res.,TRUE
21478363,27,8.68,4.45,5.70,1.95,74,2011,Biological systems discovery in silico: radical S-adenosylmethionine protein families and their target peptides for posttranslational modification.,"Haft, Daniel H; Basu, Malay Kumar",J. Bacteriol.,TRUE
21480476,3,0.96,2.82,2.72,0.34,18,2011,Implementing the elements of morphology in the American Journal of Medical Genetics.,"Biesecker, Leslie G; Carey, John C",Am. J. Med. Genet. A,TRUE
21490707,50,16.08,4.60,5.97,3.50,88.5,2011,Genome-wide meta-analysis identifies regions on 7p21 (AHR) and 15q24 (CYP1A2) as determinants of habitual caffeine consumption.,"Cornelis, Marilyn C; Monda, Keri L; Yu, Kai; Paynter, Nina; Azzato, Elizabeth M; Bennett, Siiri N; Berndt, Sonja I; Boerwinkle, Eric; Chanock, Stephen; Chatterjee, Nilanjan; Couper, David; Curhan, Gary; Heiss, Gerardo; Hu, Frank B; Hunter, David J; Jacobs, Kevin; Jensen, Majken K; Kraft, Peter; Landi, Maria Teresa; Nettleton, Jennifer A; Purdue, Mark P; Rajaraman, Preetha; Rimm, Eric B; Rose, Lynda M; Rothman, Nathaniel; Silverman, Debra; Stolzenberg-Solomon, Rachael; Subar, Amy; Yeager, Meredith; Chasman, Daniel I; van Dam, Rob M; Caporaso, Neil E",PLoS Genet.,TRUE
21492978,12,3.86,4.18,5.22,0.92,47,2011,"Social isolation, C-reactive protein, and coronary heart disease mortality among community-dwelling adults.","Heffner, Kathi L; Waring, Molly E; Roberts, Mary B; Eaton, Charles B; Gramling, Robert",Soc Sci Med,TRUE
21508125,28,9.01,5.66,7.92,1.59,67.2,2011,Myelodysplasia in autosomal dominant and sporadic monocytopenia immunodeficiency syndrome: diagnostic features and clinical implications.,"Calvo, Katherine R; Vinh, Donald C; Maric, Irina; Wang, Weixin; Noel, Pierre; Stetler-Stevenson, Maryalice; Arthur, Diane C; Raffeld, Mark; Dutra, Amalia; Pak, Evgenia; Myung, Kyungjae; Hsu, Amy P; Hickstein, Dennis D; Pittaluga, Stefania; Holland, Steven M",Haematologica,TRUE
21508414,33,10.61,3.47,3.92,3.06,85.9,2011,A study of machine-learning-based approaches to extract clinical entities and their assertions from discharge summaries.,"Jiang, Min; Chen, Yukun; Liu, Mei; Rosenbloom, S Trent; Mani, Subramani; Denny, Joshua C; Xu, Hua",J Am Med Inform Assoc,TRUE
