PubMed ID,Total Citations,Citations per Year,Expected Citations per Year,Field Citation Rate,Relative Citation Ratio,NIH Percentile,Year,Title,Authors,Journal,Article?
19415691,49,11.93,3.71,4.67,3.22,86.9,2010,"Linear clinical progression, independent of age of onset, in Niemann-Pick disease, type C.","Yanjanin, Nicole M; Vélez, Jorge I; Gropman, Andrea; King, Kelly; Bianconi, Simona E; Conley, Sandra K; Brewer, Carmen C; Solomon, Beth; Pavan, William J; Arcos-Burgos, Mauricio; Patterson, Marc C; Porter, Forbes D",Am. J. Med. Genet. B Neuropsychiatr. Genet.,TRUE
19517422,44,10.71,3.72,4.70,2.88,84.6,2010,Plasmonic nanoprobes for SERS biosensing and bioimaging.,"Vo-Dinh, Tuan; Wang, Hsin-Neng; Scaffidi, Jonathan",J Biophotonics,FALSE
19696751,27,6.57,5.17,7.61,1.27,59,2010,Admixture mapping of obesity-related traits in African Americans: the Atherosclerosis Risk in Communities (ARIC) Study.,"Cheng, Ching-Yu; Reich, David; Coresh, Josef; Boerwinkle, Eric; Patterson, Nick; Li, Man; North, Kari E; Tandon, Arti; Bailey-Wilson, Joan E; Wilson, James G; Kao, W H Linda",Obesity (Silver Spring),TRUE
19731376,6,1.46,5.39,8.05,0.27,13.9,2010,The energetics of the acetylation switch in p53-mediated transcriptional activation.,"Eichenbaum, Kenneth D; Rodríguez, Yoel; Mezei, Mihaly; Osman, Roman",Proteins,TRUE
19801719,24,5.84,4.45,6.15,1.31,60.3,2010,Green technologies for room temperature nucleic acid storage.,"Wan, Eunice; Akana, Matthew; Pons, Jennifer; Chen, Justin; Musone, Stacy; Kwok, Pui-Yan; Liao, Wilson",Curr Issues Mol Biol,TRUE
19854023,11,2.68,3.15,3.56,0.85,44,2010,The role of numeracy on client knowledge in BRCA genetic counseling.,"Portnoy, David B; Roter, Debra; Erby, Lori H",Patient Educ Couns,TRUE
19908840,70,17.04,4.21,5.69,4.04,90.9,2010,"Quantitative analyses of aggregation, autofluorescence, and reactivity artifacts in a screen for inhibitors of a thiol protease.","Jadhav, Ajit; Ferreira, Rafaela S; Klumpp, Carleen; Mott, Bryan T; Austin, Christopher P; Inglese, James; Thomas, Craig J; Maloney, David J; Shoichet, Brian K; Simeonov, Anton",J. Med. Chem.,TRUE
19955211,86,20.93,6.46,10.20,3.24,87,2010,Genomic study of replication initiation in human chromosomes reveals the influence of transcription regulation and chromatin structure on origin selection.,"Karnani, Neerja; Taylor, Christopher M; Malhotra, Ankit; Dutta, Anindya",Mol. Biol. Cell,TRUE
19996087,122,29.69,6.57,10.41,4.52,92.4,2010,Drosophila ORC localizes to open chromatin and marks sites of cohesin complex loading.,"MacAlpine, Heather K; Gordân, Raluca; Powell, Sara K; Hartemink, Alexander J; MacAlpine, David M",Genome Res.,TRUE
20020477,33,8.03,4.14,5.53,1.94,73.9,2010,Proteomics enhances evolutionary and functional analysis of reproductive proteins.,"Findlay, Geoffrey D; Swanson, Willie J",Bioessays,FALSE
20023643,24,5.84,3.87,4.99,1.51,65.4,2010,Colloidal lenses allow high-temperature single-molecule imaging and improve fluorophore photostability.,"Schwartz, Jerrod J; Stavrakis, Stavros; Quake, Stephen R",Nat Nanotechnol,TRUE
20023645,149,36.26,4.45,6.16,8.15,97.4,2010,Electrostatic focusing of unlabelled DNA into nanoscale pores using a salt gradient.,"Wanunu, Meni; Morrison, Will; Rabin, Yitzhak; Grosberg, Alexander Y; Meller, Amit",Nat Nanotechnol,TRUE
20026024,5,1.22,5.47,8.20,0.22,11.2,2010,hunchback and Ikaros-like zinc finger genes control reproductive system development in Caenorhabditis elegans.,"Large, Edward E; Mathies, Laura D",Dev. Biol.,TRUE
20031968,25,6.08,6.62,10.52,0.92,46.8,2010,CMDS: a population-based method for identifying recurrent DNA copy number aberrations in cancer from high-resolution data.,"Zhang, Qunyuan; Ding, Li; Larson, David E; Koboldt, Daniel C; McLellan, Michael D; Chen, Ken; Shi, Xiaoqi; Kraja, Aldi; Mardis, Elaine R; Wilson, Richard K; Borecki, Ingrid B; Province, Michael A",Bioinformatics,TRUE
20040591,33,8.03,6.46,10.18,1.24,58.3,2010,The nuclear experience of CPEB: implications for RNA processing and translational control.,"Lin, Chien-Ling; Evans, Veronica; Shen, Shihao; Xing, Yi; Richter, Joel D",RNA,TRUE
20040767,50,12.17,5.13,7.53,2.37,79.8,2010,Duffy antigen receptor for chemokines (Darc) polymorphism regulates circulating concentrations of monocyte chemoattractant protein-1 and other inflammatory mediators.,"Schnabel, Renate B; Baumert, Jens; Barbalic, Maja; Dupuis, Josée; Ellinor, Patrick T; Durda, Peter; Dehghan, Abbas; Bis, Joshua C; Illig, Thomas; Morrison, Alanna C; Jenny, Nancy S; Keaney, John F; Gieger, Christian; Tilley, Cathy; Yamamoto, Jennifer F; Khuseyinova, Natalie; Heiss, Gerardo; Doyle, Margaret; Blankenberg, Stefan; Herder, Christian; Walston, Jeremy D; Zhu, Yanyan; Vasan, Ramachandran S; Klopp, Norman; Boerwinkle, Eric; Larson, Martin G; Psaty, Bruce M; Peters, Annette; Ballantyne, Christie M; Witteman, Jacqueline C M; Hoogeveen, Ron C; Benjamin, Emelia J; Koenig, Wolfgang; Tracy, Russell P",Blood,TRUE
20051669,6,1.93,3.27,3.53,0.59,31.7,2011,Educating underserved Latino communities about family health history using lay health advisors.,"Kaphingst, K A; Lachance, C R; Gepp, A; D'Anna, L Hoyt; Rios-Ellis, B",Public Health Genomics,TRUE
20067776,54,13.14,4.57,6.40,2.88,84.5,2010,Identification of known drugs that act as inhibitors of NF-kappaB signaling and their mechanism of action.,"Miller, Susanne C; Huang, Ruili; Sakamuru, Srilatha; Shukla, Sunita J; Attene-Ramos, Matias S; Shinn, Paul; Van Leer, Danielle; Leister, William; Austin, Christopher P; Xia, Menghang",Biochem. Pharmacol.,TRUE
20098329,33,8.03,3.16,3.58,2.54,81.5,2010,The role of race and trust in tissue/blood donation for genetic research.,"Bussey-Jones, Jada; Garrett, Joanne; Henderson, Gail; Moloney, Mairead; Blumenthal, Connie; Corbie-Smith, Giselle",Genet. Med.,TRUE
20098672,24,5.84,4.18,5.61,1.40,62.6,2010,Genome wide association for addiction: replicated results and comparisons of two analytic approaches.,"Drgon, Tomas; Zhang, Ping-Wu; Johnson, Catherine; Walther, Donna; Hess, Judith; Nino, Michelle; Uhl, George R",PLoS ONE,TRUE
20104610,15,3.65,3.94,5.13,0.93,47.2,2010,Holoprosencephaly due to numeric chromosome abnormalities.,"Solomon, Benjamin D; Rosenbaum, Kenneth N; Meck, Jeanne M; Muenke, Maximilian",Am J Med Genet C Semin Med Genet,FALSE
20123131,14,4.50,4.83,6.40,0.93,47.4,2011,Hematopoietic cell types: prototype for a revised cell ontology.,"Diehl, Alexander D; Augustine, Alison Deckhut; Blake, Judith A; Cowell, Lindsay G; Gold, Elizabeth S; Gondré-Lewis, Timothy A; Masci, Anna Maria; Meehan, Terrence F; Morel, Penelope A; Nijnik, Anastasia; Peters, Bjoern; Pulendran, Bali; Scheuermann, Richard H; Yao, Q Alison; Zand, Martin S; Mungall, Christopher J",J Biomed Inform,TRUE
20123155,9,2.19,5.84,8.96,0.37,19.8,2010,Somatic mosaicism in the Wiskott-Aldrich syndrome: molecular and functional characterization of genotypic revertants.,"Davis, Brian R; Yan, Qing; Bui, Jacquelin H; Felix, Kumar; Moratto, Daniele; Muul, Linda M; Prokopishyn, Nicole L; Blaese, R Michael; Candotti, Fabio",Clin. Immunol.,TRUE
20137778,24,5.84,4.63,6.52,1.26,58.8,2010,Homozygosity mapping reveals mutations of GRXCR1 as a cause of autosomal-recessive nonsyndromic hearing impairment.,"Schraders, Margit; Lee, Kwanghyuk; Oostrik, Jaap; Huygen, Patrick L M; Ali, Ghazanfar; Hoefsloot, Lies H; Veltman, Joris A; Cremers, Frans P M; Basit, Sulman; Ansar, Muhammad; Cremers, Cor W R J; Kunst, Henricus P M; Ahmad, Wasim; Admiraal, Ronald J C; Leal, Suzanne M; Kremer, Hannie",Am. J. Hum. Genet.,TRUE
20147318,54,13.14,5.11,7.48,2.57,81.9,2010,"Genetic variants in ABO blood group region, plasma soluble E-selectin levels and risk of type 2 diabetes.","Qi, Lu; Cornelis, Marilyn C; Kraft, Peter; Jensen, Majken; van Dam, Rob M; Sun, Qi; Girman, Cynthia J; Laurie, Cathy C; Mirel, Daniel B; Hunter, David J; Rimm, Eric; Hu, Frank B",Hum. Mol. Genet.,TRUE
20148029,217,52.81,5.16,7.58,10.24,98.3,2010,Ancient human genome sequence of an extinct Palaeo-Eskimo.,"Rasmussen, Morten; Li, Yingrui; Lindgreen, Stinus; Pedersen, Jakob Skou; Albrechtsen, Anders; Moltke, Ida; Metspalu, Mait; Metspalu, Ene; Kivisild, Toomas; Gupta, Ramneek; Bertalan, Marcelo; Nielsen, Kasper; Gilbert, M Thomas P; Wang, Yong; Raghavan, Maanasa; Campos, Paula F; Kamp, Hanne Munkholm; Wilson, Andrew S; Gledhill, Andrew; Tridico, Silvana; Bunce, Michael; Lorenzen, Eline D; Binladen, Jonas; Guo, Xiaosen; Zhao, Jing; Zhang, Xiuqing; Zhang, Hao; Li, Zhuo; Chen, Minfeng; Orlando, Ludovic; Kristiansen, Karsten; Bak, Mads; Tommerup, Niels; Bendixen, Christian; Pierre, Tracey L; Grønnow, Bjarne; Meldgaard, Morten; Andreasen, Claus; Fedorova, Sardana A; Osipova, Ludmila P; Higham, Thomas F G; Ramsey, Christopher Bronk; Hansen, Thomas V O; Nielsen, Finn C; Crawford, Michael H; Brunak, Søren; Sicheritz-Pontén, Thomas; Villems, Richard; Nielsen, Rasmus; Krogh, Anders; Wang, Jun; Willerslev, Eske",Nature,FALSE
20157310,72,17.52,4.39,6.05,3.99,90.6,2010,"A common variant of the latrophilin 3 gene, LPHN3, confers susceptibility to ADHD and predicts effectiveness of stimulant medication.","Arcos-Burgos, M; Jain, M; Acosta, M T; Shively, S; Stanescu, H; Wallis, D; Domené, S; Vélez, J I; Karkera, J D; Balog, J; Berg, K; Kleta, R; Gahl, W A; Roessler, E; Long, R; Lie, J; Pineda, D; Londoño, A C; Palacio, J D; Arbelaez, A; Lopera, F; Elia, J; Hakonarson, H; Johansson, S; Knappskog, P M; Haavik, J; Ribases, M; Cormand, B; Bayes, M; Casas, M; Ramos-Quiroga, J A; Hervas, A; Maher, B S; Faraone, S V; Seitz, C; Freitag, C M; Palmason, H; Meyer, J; Romanos, M; Walitza, S; Hemminger, U; Warnke, A; Romanos, J; Renner, T; Jacob, C; Lesch, K-P; Swanson, J; Vortmeyer, A; Bailey-Wilson, J E; Castellanos, F X; Muenke, M",Mol. Psychiatry,TRUE
20157827,4,0.97,4.64,6.54,0.21,10.5,2010,Population description and its role in the interpretation of genetic association.,"Fullerton, Stephanie M; Yu, Joon-Ho; Crouch, Julia; Fryer-Edwards, Kelly; Burke, Wylie",Hum. Genet.,FALSE
20184892,16,3.89,4.32,5.91,0.90,46.1,2010,The membrane complex between transducin and dark-state rhodopsin exhibits large-amplitude interface dynamics on the sub-microsecond timescale: insights from all-atom MD simulations.,"Sgourakis, Nikolaos G; Garcia, Angel E",J. Mol. Biol.,TRUE
20202923,215,52.32,4.38,6.01,11.96,98.7,2010,A genome-wide association study of alcohol dependence.,"Bierut, Laura J; Agrawal, Arpana; Bucholz, Kathleen K; Doheny, Kimberly F; Laurie, Cathy; Pugh, Elizabeth; Fisher, Sherri; Fox, Louis; Howells, William; Bertelsen, Sarah; Hinrichs, Anthony L; Almasy, Laura; Breslau, Naomi; Culverhouse, Robert C; Dick, Danielle M; Edenberg, Howard J; Foroud, Tatiana; Grucza, Richard A; Hatsukami, Dorothy; Hesselbrock, Victor; Johnson, Eric O; Kramer, John; Krueger, Robert F; Kuperman, Samuel; Lynskey, Michael; Mann, Karl; Neuman, Rosalind J; Nöthen, Markus M; Nurnberger, John I; Porjesz, Bernice; Ridinger, Monika; Saccone, Nancy L; Saccone, Scott F; Schuckit, Marc A; Tischfield, Jay A; Wang, Jen C; Rietschel, Marcella; Goate, Alison M; Rice, John P;",Proc. Natl. Acad. Sci. U.S.A.,TRUE
20204374,3,0.73,5.50,8.26,0.13,6.5,2010,Conserved regulatory motifs at phenylethanolamine N-methyltransferase (PNMT) are disrupted by common functional genetic variation: an integrated computational/experimental approach.,"Rodríguez-Flores, Juan L; Zhang, Kuixing; Kang, Sun Woo; Wen, Gen; Ghosh, Sajalendu; Friese, Ryan S; Mahata, Sushil K; Subramaniam, Shankar; Hamilton, Bruce A; O'Connor, Daniel T",Mamm. Genome,TRUE
20211274,21,6.75,3.84,4.59,1.76,70.6,2011,NanoParticle Ontology for cancer nanotechnology research.,"Thomas, Dennis G; Pappu, Rohit V; Baker, Nathan A",J Biomed Inform,TRUE
20222956,25,6.08,6.08,9.43,1.00,50,2010,Genome-wide functional analysis of human 5' untranslated region introns.,"Cenik, Can; Derti, Adnan; Mellor, Joseph C; Berriz, Gabriel F; Roth, Frederick P",Genome Biol.,TRUE
20305652,34,8.27,6.17,9.60,1.34,61.1,2010,Direct determination of molecular haplotypes by chromosome microdissection.,"Ma, Li; Xiao, Yan; Huang, Hui; Wang, Qingwei; Rao, Weinian; Feng, Yue; Zhang, Kui; Song, Qing",Nat. Methods,TRUE
20307317,5,1.22,5.22,7.71,0.23,11.7,2010,Evidence of perturbations of cell cycle and DNA repair pathways as a consequence of human and murine NF1-haploinsufficiency.,"Pemov, Alexander; Park, Caroline; Reilly, Karlyne M; Stewart, Douglas R",BMC Genomics,TRUE
20334679,27,6.57,4.33,5.93,1.52,65.5,2010,Alignment and clustering of phylogenetic markers--implications for microbial diversity studies.,"White, James R; Navlakha, Saket; Nagarajan, Niranjan; Ghodsi, Mohammad-Reza; Kingsford, Carl; Pop, Mihai",BMC Bioinformatics,TRUE
20336069,132,32.12,6.89,11.05,4.67,92.8,2010,Chromatin signature of embryonic pluripotency is established during genome activation.,"Vastenhouw, Nadine L; Zhang, Yong; Woods, Ian G; Imam, Farhad; Regev, Aviv; Liu, X Shirley; Rinn, John; Schier, Alexander F",Nature,TRUE
20358117,2,0.49,4.04,5.34,0.12,5.9,2010,"Infrared light induced patterning of proteins on ppNIPAM thermoresponsive thin films: a ""protein laser printer"".","Cheng, Xuanhong; Yegan Erdem, E; Takeuchi, Shoji; Fujita, Hiroyuki; Ratner, Buddy D; Böhringer, Karl F",Lab Chip,TRUE
20379604,39,9.49,3.92,5.10,2.42,80.3,2010,Human mammalian cell sorting using a highly integrated micro-fabricated fluorescence-activated cell sorter (microFACS).,"Cho, Sung Hwan; Chen, Chun H; Tsai, Frank S; Godin, Jessica M; Lo, Yu-Hwa",Lab Chip,TRUE
20385882,57,13.87,3.35,3.95,4.14,91.2,2010,Practice parameter update: evaluation and management of driving risk in dementia: report of the Quality Standards Subcommittee of the American Academy of Neurology.,"Iverson, D J; Gronseth, G S; Reger, M A; Classen, S; Dubinsky, R M; Rizzo, M;",Neurology,FALSE
20393307,1,0.24,5.90,9.08,0.04,2.6,2010,Impact of gene patents and licensing practices on access to genetic testing for hearing loss.,"Chandrasekharan, Subhashini; Fiffer, Melissa",Genet. Med.,TRUE
20393308,12,2.92,4.91,7.08,0.60,32,2010,Impact of gene patents and licensing practices on access to genetic testing for cystic fibrosis.,"Chandrasekharan, Subhashini; Heaney, Christopher; James, Tamara; Conover, Chris; Cook-Deegan, Robert",Genet. Med.,TRUE
20393554,546,132.88,6.00,9.27,22.15,99.6,2010,International network of cancer genome projects.,"Hudson, Thomas J; Anderson, Warwick; Artez, Axel; Barker, Anna D; Bell, Cindy; Bernabé, Rosa R; Bhan, M K; Calvo, Fabien; Eerola, Iiro; Gerhard, Daniela S; Guttmacher, Alan; Guyer, Mark; Hemsley, Fiona M; Jennings, Jennifer L; Kerr, David; Klatt, Peter; Kolar, Patrik; Kusada, Jun; Lane, David P; Laplace, Frank; Youyong, Lu; Nettekoven, Gerd; Ozenberger, Brad; Peterson, Jane; Rao, T S; Remacle, Jacques; Schafer, Alan J; Shibata, Tatsuhiro; Stratton, Michael R; Vockley, Joseph G; Watanabe, Koichi; Yang, Huanming; Yuen, Matthew M F; Knoppers, Bartha M; Bobrow, Martin; Cambon-Thomsen, Anne; Dressler, Lynn G; Dyke, Stephanie O M; Joly, Yann; Kato, Kazuto; Kennedy, Karen L; Nicolás, Pilar; Parker, Michael J; Rial-Sebbag, Emmanuelle; Romeo-Casabona, Carlos M; Shaw, Kenna M; Wallace, Susan; Wiesner, Georgia L; Zeps, Nikolajs; Lichter, Peter; Biankin, Andrew V; Chabannon, Christian; Chin, Lynda; Clément, Bruno; de Alava, Enrique; Degos, Françoise; Ferguson, Martin L; Geary, Peter; Hayes, D Neil; Hudson, Thomas J; Johns, Amber L; Kasprzyk, Arek; Nakagawa, Hidewaki; Penny, Robert; Piris, Miguel A; Sarin, Rajiv; Scarpa, Aldo; Shibata, Tatsuhiro; van de Vijver, Marc; Futreal, P Andrew; Aburatani, Hiroyuki; Bayés, Mónica; Botwell, David D L; Campbell, Peter J; Estivill, Xavier; Gerhard, Daniela S; Grimmond, Sean M; Gut, Ivo; Hirst, Martin; López-Otín, Carlos; Majumder, Partha; Marra, Marco; McPherson, John D; Nakagawa, Hidewaki; Ning, Zemin; Puente, Xose S; Ruan, Yijun; Shibata, Tatsuhiro; Stratton, Michael R; Stunnenberg, Hendrik G; Swerdlow, Harold; Velculescu, Victor E; Wilson, Richard K; Xue, Hong H; Yang, Liu; Spellman, Paul T; Bader, Gary D; Boutros, Paul C; Campbell, Peter J; Flicek, Paul; Getz, Gad; Guigó, Roderic; Guo, Guangwu; Haussler, David; Heath, Simon; Hubbard, Tim J; Jiang, Tao; Jones, Steven M; Li, Qibin; López-Bigas, Nuria; Luo, Ruibang; Muthuswamy, Lakshmi; Ouellette, B F Francis; Pearson, John V; Puente, Xose S; Quesada, Victor; Raphael, Benjamin J; Sander, Chris; Shibata, Tatsuhiro; Speed, Terence P; Stein, Lincoln D; Stuart, Joshua M; Teague, Jon W; Totoki, Yasushi; Tsunoda, Tatsuhiko; Valencia, Alfonso; Wheeler, David A; Wu, Honglong; Zhao, Shancen; Zhou, Guangyu; Stein, Lincoln D; Guigó, Roderic; Hubbard, Tim J; Joly, Yann; Jones, Steven M; Kasprzyk, Arek; Lathrop, Mark; López-Bigas, Nuria; Ouellette, B F Francis; Spellman, Paul T; Teague, Jon W; Thomas, Gilles; Valencia, Alfonso; Yoshida, Teruhiko; Kennedy, Karen L; Axton, Myles; Dyke, Stephanie O M; Futreal, P Andrew; Gerhard, Daniela S; Gunter, Chris; Guyer, Mark; Hudson, Thomas J; McPherson, John D; Miller, Linda J; Ozenberger, Brad; Shaw, Kenna M; Kasprzyk, Arek; Stein, Lincoln D; Zhang, Junjun; Haider, Syed A; Wang, Jianxin; Yung, Christina K; Cros, Anthony; Cross, Anthony; Liang, Yong; Gnaneshan, Saravanamuttu; Guberman, Jonathan; Hsu, Jack; Bobrow, Martin; Chalmers, Don R C; Hasel, Karl W; Joly, Yann; Kaan, Terry S H; Kennedy, Karen L; Knoppers, Bartha M; Lowrance, William W; Masui, Tohru; Nicolás, Pilar; Rial-Sebbag, Emmanuelle; Rodriguez, Laura Lyman; Vergely, Catherine; Yoshida, Teruhiko; Grimmond, Sean M; Biankin, Andrew V; Bowtell, David D L; Cloonan, Nicole; deFazio, Anna; Eshleman, James R; Etemadmoghadam, Dariush; Gardiner, Brooke B; Gardiner, Brooke A; Kench, James G; Scarpa, Aldo; Sutherland, Robert L; Tempero, Margaret A; Waddell, Nicola J; Wilson, Peter J; McPherson, John D; Gallinger, Steve; Tsao, Ming-Sound; Shaw, Patricia A; Petersen, Gloria M; Mukhopadhyay, Debabrata; Chin, Lynda; DePinho, Ronald A; Thayer, Sarah; Muthuswamy, Lakshmi; Shazand, Kamran; Beck, Timothy; Sam, Michelle; Timms, Lee; Ballin, Vanessa; Lu, Youyong; Ji, Jiafu; Zhang, Xiuqing; Chen, Feng; Hu, Xueda; Zhou, Guangyu; Yang, Qi; Tian, Geng; Zhang, Lianhai; Xing, Xiaofang; Li, Xianghong; Zhu, Zhenggang; Yu, Yingyan; Yu, Jun; Yang, Huanming; Lathrop, Mark; Tost, Jörg; Brennan, Paul; Holcatova, Ivana; Zaridze, David; Brazma, Alvis; Egevard, Lars; Prokhortchouk, Egor; Banks, Rosamonde Elizabeth; Uhlén, Mathias; Cambon-Thomsen, Anne; Viksna, Juris; Ponten, Fredrik; Skryabin, Konstantin; Stratton, Michael R; Futreal, P Andrew; Birney, Ewan; Borg, Ake; Børresen-Dale, Anne-Lise; Caldas, Carlos; Foekens, John A; Martin, Sancha; Reis-Filho, Jorge S; Richardson, Andrea L; Sotiriou, Christos; Stunnenberg, Hendrik G; Thoms, Giles; van de Vijver, Marc; van't Veer, Laura; Calvo, Fabien; Birnbaum, Daniel; Blanche, Hélène; Boucher, Pascal; Boyault, Sandrine; Chabannon, Christian; Gut, Ivo; Masson-Jacquemier, Jocelyne D; Lathrop, Mark; Pauporté, Iris; Pivot, Xavier; Vincent-Salomon, Anne; Tabone, Eric; Theillet, Charles; Thomas, Gilles; Tost, Jörg; Treilleux, Isabelle; Calvo, Fabien; Bioulac-Sage, Paulette; Clément, Bruno; Decaens, Thomas; Degos, Françoise; Franco, Dominique; Gut, Ivo; Gut, Marta; Heath, Simon; Lathrop, Mark; Samuel, Didier; Thomas, Gilles; Zucman-Rossi, Jessica; Lichter, Peter; Eils, Roland; Brors, Benedikt; Korbel, Jan O; Korshunov, Andrey; Landgraf, Pablo; Lehrach, Hans; Pfister, Stefan; Radlwimmer, Bernhard; Reifenberger, Guido; Taylor, Michael D; von Kalle, Christof; Majumder, Partha P; Sarin, Rajiv; Rao, T S; Bhan, M K; Scarpa, Aldo; Pederzoli, Paolo; Lawlor, Rita A; Delledonne, Massimo; Bardelli, Alberto; Biankin, Andrew V; Grimmond, Sean M; Gress, Thomas; Klimstra, David; Zamboni, Giuseppe; Shibata, Tatsuhiro; Nakamura, Yusuke; Nakagawa, Hidewaki; Kusada, Jun; Tsunoda, Tatsuhiko; Miyano, Satoru; Aburatani, Hiroyuki; Kato, Kazuto; Fujimoto, Akihiro; Yoshida, Teruhiko; Campo, Elias; López-Otín, Carlos; Estivill, Xavier; Guigó, Roderic; de Sanjosé, Silvia; Piris, Miguel A; Montserrat, Emili; González-Díaz, Marcos; Puente, Xose S; Jares, Pedro; Valencia, Alfonso; Himmelbauer, Heinz; Himmelbaue, Heinz; Quesada, Victor; Bea, Silvia; Stratton, Michael R; Futreal, P Andrew; Campbell, Peter J; Vincent-Salomon, Anne; Richardson, Andrea L; Reis-Filho, Jorge S; van de Vijver, Marc; Thomas, Gilles; Masson-Jacquemier, Jocelyne D; Aparicio, Samuel; Borg, Ake; Børresen-Dale, Anne-Lise; Caldas, Carlos; Foekens, John A; Stunnenberg, Hendrik G; van't Veer, Laura; Easton, Douglas F; Spellman, Paul T; Martin, Sancha; Barker, Anna D; Chin, Lynda; Collins, Francis S; Compton, Carolyn C; Ferguson, Martin L; Gerhard, Daniela S; Getz, Gad; Gunter, Chris; Guttmacher, Alan; Guyer, Mark; Hayes, D Neil; Lander, Eric S; Ozenberger, Brad; Penny, Robert; Peterson, Jane; Sander, Chris; Shaw, Kenna M; Speed, Terence P; Spellman, Paul T; Vockley, Joseph G; Wheeler, David A; Wilson, Richard K; Hudson, Thomas J; Chin, Lynda; Knoppers, Bartha M; Lander, Eric S; Lichter, Peter; Stein, Lincoln D; Stratton, Michael R; Anderson, Warwick; Barker, Anna D; Bell, Cindy; Bobrow, Martin; Burke, Wylie; Collins, Francis S; Compton, Carolyn C; DePinho, Ronald A; Easton, Douglas F; Futreal, P Andrew; Gerhard, Daniela S; Green, Anthony R; Guyer, Mark; Hamilton, Stanley R; Hubbard, Tim J; Kallioniemi, Olli P; Kennedy, Karen L; Ley, Timothy J; Liu, Edison T; Lu, Youyong; Majumder, Partha; Marra, Marco; Ozenberger, Brad; Peterson, Jane; Schafer, Alan J; Spellman, Paul T; Stunnenberg, Hendrik G; Wainwright, Brandon J; Wilson, Richard K; Yang, Huanming",Nature,TRUE
20400778,39,9.49,5.69,8.66,1.67,68.8,2010,Genomic variation associated with mortality among adults of European and African ancestry with heart failure: the cohorts for heart and aging research in genomic epidemiology consortium.,"Morrison, Alanna C; Felix, Janine F; Cupples, L Adrienne; Glazer, Nicole L; Loehr, Laura R; Dehghan, Abbas; Demissie, Serkalem; Bis, Joshua C; Rosamond, Wayne D; Aulchenko, Yurii S; Wang, Ying A; Haritunians, Talin; Folsom, Aaron R; Rivadeneira, Fernando; Benjamin, Emelia J; Lumley, Thomas; Couper, David; Stricker, Bruno H; O'Donnell, Christopher J; Rice, Kenneth M; Chang, Patricia P; Hofman, Albert; Levy, Daniel; Rotter, Jerome I; Fox, Ervin R; Uitterlinden, Andre G; Wang, Thomas J; Psaty, Bruce M; Willerson, James T; van Duijn, Cornelia M; Boerwinkle, Eric; Witteman, Jacqueline C M; Vasan, Ramachandran S; Smith, Nicholas L",Circ Cardiovasc Genet,TRUE
20417618,11,2.68,5.40,8.07,0.50,26.6,2010,Deficiency of cyclin-dependent kinase inhibitors p21Cip1 and p27Kip1 accelerates atherogenesis in apolipoprotein E-deficient mice.,"Akyürek, Levent M; Boehm, Manfred; Olive, Michelle; Zhou, Alex-Xianghua; San, Hong; Nabel, Elizabeth G",Biochem. Biophys. Res. Commun.,TRUE
20444308,18,5.79,3.13,3.29,1.85,72.3,2011,"Controlled cross-over study in normal subjects of naloxone-preceding-lactate infusions; respiratory and subjective responses: relationship to endogenous opioid system, suffocation false alarm theory and childhood parental loss.","Preter, M; Lee, S H; Petkova, E; Vannucci, M; Kim, S; Klein, D F",Psychol Med,TRUE
20460505,27,6.57,3.83,4.92,1.72,69.8,2010,The skin cancer chemotherapeutic agent ingenol-3-angelate (PEP005) is a substrate for the epidermal multidrug transporter (ABCB1) and targets tumor vasculature.,"Li, Luowei; Shukla, Suneet; Lee, Andrew; Garfield, Susan H; Maloney, David J; Ambudkar, Suresh V; Yuspa, Stuart H",Cancer Res.,TRUE
20490471,16,3.89,4.74,6.75,0.82,42.8,2010,An improved one-tube RT-PCR protocol for analyzing single-cell gene expression in individual mammalian cells.,"Li, Yongzhong; Thompson, Hansa; Hemphill, Courtney; Hong, Fan; Forrester, Jessica; Johnson, Roger H; Zhang, Weiwen; Meldrum, Deirdre R",Anal Bioanal Chem,TRUE
20461743,3,0.73,5.82,8.90,0.13,6.1,2010,A high-throughput screen for chemical inhibitors of exocytic transport in yeast.,"Zhang, Lisha; Nebane, N Miranda; Wennerberg, Krister; Li, Yujie; Neubauer, Valerie; Hobrath, Judith V; McKellip, Sara; Rasmussen, Lynn; Shindo, Nice; Sosa, Melinda; Maddry, Joseph A; Ananthan, Subramaniam; Piazza, Gary A; White, E Lucile; Harsay, Edina",Chembiochem,TRUE
20466822,27,6.57,4.63,6.52,1.42,63.1,2010,A small-molecule oxocarbazate inhibitor of human cathepsin L blocks severe acute respiratory syndrome and ebola pseudotype virus infection into human embryonic kidney 293T cells.,"Shah, Parag P; Wang, Tianhua; Kaletsky, Rachel L; Myers, Michael C; Purvis, Jeremy E; Jing, Huiyan; Huryn, Donna M; Greenbaum, Doron C; Smith, Amos B; Bates, Paul; Diamond, Scott L",Mol. Pharmacol.,TRUE
20603105,20,4.87,5.98,9.23,0.81,42.5,2010,"IDH1(R132) mutation identified in one human melanoma metastasis, but not correlated with metastases to the brain.","Lopez, Giselle Y; Reitman, Zachary J; Solomon, David; Waldman, Todd; Bigner, Darell D; McLendon, Roger E; Rosenberg, Steven A; Samuels, Yardena; Yan, Hai",Biochem. Biophys. Res. Commun.,TRUE
20486773,21,5.11,4.02,5.30,1.27,59,2010,Liver-directed recombinant adeno-associated viral gene delivery rescues a lethal mouse model of methylmalonic acidemia and provides long-term phenotypic correction.,"Carrillo-Carrasco, Nuria; Chandler, Randy J; Chandrasekaran, Suma; Venditti, Charles P",Hum. Gene Ther.,TRUE
20529293,11,2.68,4.98,7.23,0.54,28.9,2010,A combined genome-wide linkage and association approach to find susceptibility loci for platelet function phenotypes in European American and African American families with coronary artery disease.,"Mathias, Rasika A; Kim, Yoonhee; Sung, Heejong; Yanek, Lisa R; Mantese, V J; Hererra-Galeano, J Enrique; Ruczinski, Ingo; Wilson, Alexander F; Faraday, Nauder; Becker, Lewis C; Becker, Diane M",BMC Med Genomics,TRUE
20572109,2,0.49,3.12,3.49,0.16,7.6,2010,The future of prenatal cytogenetic diagnostics: a personal perspective.,"Lee, Charles",Prenat. Diagn.,TRUE
